original english paragraphs,deepl paragraphs,google paragraphs,human-translated paragraphs
"the occasional howling of the martians had ceased; they took up their
positions in the huge crescent about their cylinders in absolute
silence. it was a crescent with twelve miles between its horns. never
since the devising of gunpowder was the beginning of a battle so still.
to us and to an observer about ripley it would have had precisely the
same effect—the martians seemed in solitary possession of the darkling
night, lit only as it was by the slender moon, the stars, the afterglow
of the daylight, and the ruddy glare from st. george’s hill and the
woods of painshill.","les hurlements occasionnels des martiens avaient cessé ; ils avaient pris leurs
positions dans l'immense croissant autour de leurs cylindres dans un silence absolu.
c'était un croissant dont les cornes étaient distantes de douze milles. jamais, depuis l'invention de la poudre à canon, le début d'une bataille n'avait été aussi calme.
depuis l'invention de la poudre à canon, le début d'une bataille n'avait jamais été aussi calme.
pour nous et pour un observateur aux alentours de ripley, cela aurait eu exactement le meme effet.
de l'effet, les martiens semblaient en possession solitaire de la nuit obscure
de la nuit, illuminée seulement par la lune, les étoiles, les lueurs du jour, et les
de la lumiere du jour, et la lueur rougeoyante de la colline de St.
des bois de painshill.","les hurlements occasionnels des martiens avaient cessé ; ils ont pris leur
positions dans l'immense croissant autour de leurs cylindres en absolu
silence. c'était un croissant avec douze milles entre ses cornes. jamais
puisque la conception de la poudre à canon était le début d’une bataille toujours aussi longue.
pour nous et pour un observateur de Ripley, cela aurait eu précisément le
même effet : les martiens semblaient en possession solitaire du ténébreux.
nuit, éclairée uniquement par la mince lune, les étoiles, la rémanence
de la lumière du jour et l'éclat rougeoyant de st. George's Hill et le
bois de Painhill.","les hurlements que poussaient de temps à autre les marsiens avaient
cessé. dans le plus grand silence, ils prirent position en une vaste
courbe sur une ligne de douze milles d’étendue. jamais, depuis
l’invention de la poudre, un commencement de bataille n’avait été aussi
paisible. pour nous, aussi bien que pour quelqu’un qui, de ripley,
aurait pu examiner les choses, les marsiens faisaient l’effet d’être les
maîtres uniques de la nuit ténébreuse, à peine éclairée qu’elle était
par un mince croissant de lune, par les étoiles, les lueurs attardées du
couchant, et les reflets rougeâtres des incendies de st george’s hill et
des bois en flammes de painshill."
"but facing that crescent everywhere—at staines, hounslow, ditton,
esher, ockham, behind hills and woods south of the river, and across
the flat grass meadows to the north of it, wherever a cluster of trees
or village houses gave sufficient cover—the guns were waiting. the
signal rockets burst and rained their sparks through the night and
vanished, and the spirit of all those watching batteries rose to a
tense expectation. the martians had but to advance into the line of
fire, and instantly those motionless black forms of men, those guns
glittering so darkly in the early night, would explode into a
thunderous fury of battle.","mais face à ce croissant partout - à Staines, Hounslow, Ditton, Esher, Ockham, derrière les collines et les bois au sud de la rivière, et à travers le pays,
esher, ockham, derrière les collines et les bois au sud de la rivière, et à travers les prairies plates au nord de la rivière, partout où un groupe d'arbres est présent.
de l'eau, et à travers les prairies plates au nord de celle-ci, partout où un groupe d'arbres
d'arbres ou de maisons de village, les canons attendaient.
les fusées de signalisation éclatèrent et firent pleuvoir leurs étincelles dans la nuit et
et disparaissaient, et l'esprit de tous ceux qui observaient les batteries s'élevait dans une
de l'homme, de la femme, de l'homme, de l'homme, de l'homme.
de feu, et instantanément ces formes noires d'hommes immobiles, ces canons
l'obscurité de la nuit, éclateraient en une fureur de combat.
tonnerre de la bataille.","mais face à ce croissant partout-à Staines, Hounslow, ditton,
Esher, Ockham, derrière les collines et les bois au sud de la rivière, et à travers
les prairies d'herbes plates au nord de celui-ci, partout où un groupe d'arbres
ou les maisons de village offraient une couverture suffisante : les canons attendaient. le
des fusées de signalisation éclatèrent et firent pleuvoir leurs étincelles toute la nuit et
disparu, et l'esprit de tous ceux qui surveillaient les batteries s'est élevé à un
attente tendue. les martiens n'avaient qu'à avancer dans la ligne de
feu, et instantanément ces formes noires immobiles d'hommes, ces fusils
scintillant si sombre au début de la nuit, exploserait en un
fureur tonitruante du combat.","mais, faisant partout face à cette ligne d’attaque, à staines, à
hounslow, à ditton, à esher, à ockham, derrière les collines et les bois
au sud du fleuve, au nord dans les grasses prairies basses, partout où
un village ou un bouquet d’arbres offrait un suffisant abri, des canons
attendaient. les fusées-signaux éclatèrent, laissèrent pleuvoir leurs
étincelles à travers la nuit et s’évanouirent, surexcitant d’une
impatience inquiète tous ceux qui servaient ces batteries. dès que les
marsiens se seraient avancés jusqu’à portée des bouches à feu,
immédiatement, ces formes noires d’hommes immobiles seraient secouées
par l’ardeur du combat, ces canons, aux reflets sombres dans la nuit
tombante, cracheraient un furieux tonnerre."
"no doubt the thought that was uppermost in a thousand of those vigilant
minds, even as it was uppermost in mine, was the riddle—how much they
understood of us. did they grasp that we in our millions were
organized, disciplined, working together? or did they interpret our
spurts of fire, the sudden stinging of our shells, our steady
investment of their encampment, as we should the furious unanimity of
onslaught in a disturbed hive of bees? did they dream they might
exterminate us? (at that time no one knew what food they needed.) a
hundred such questions struggled together in my mind as i watched that
vast sentinel shape. and in the back of my mind was the sense of all
the huge unknown and hidden forces londonward. had they prepared
pitfalls? were the powder mills at hounslow ready as a snare? would the
londoners have the heart and courage to make a greater moscow of their
mighty province of houses?","de ces esprits vigilants, tout comme la mienne, était l'énigme suivante : combien d'argent ont-ils perdu ?
de ces esprits vigilants, comme elle l'était dans le mien, était l'énigme de savoir ce qu'ils
comprenaient-ils que nous étions des millions à être organisés, disciplinés, à travailler ensemble ?
organisés, disciplinés, travaillant ensemble ? ou bien interprétaient-ils nos
de nos tirs, la piqûre soudaine de nos obus, notre investissement constant de leur
de leur campement, comme on le ferait de l'unanimite furieuse d'un assaut
de l'unanimité furieuse d'un assaut dans une ruche d'abeilles dérangées ?
(à l'époque, personne ne savait de quelle nourriture elles avaient besoin).
cent questions de ce genre se bousculaient dans mon esprit tandis que j'observais cette vaste forme de sentinelle.
et au fond de mon esprit, il y avait le sentiment que toutes les forces immenses, inconnues et cachées, étaient présentes.
forces inconnues et cachées en direction de Londres. avaient-ils préparé des pièges ?
les moulins à poudre de Hounslow étaient-ils prêts à servir de piège ?
londoniens auraient-ils le cœur et le courage de faire de leur puissante province de maisons un plus grand moscou ?
de leur puissante province de maisons ?","sans aucun doute la pensée qui prédominait chez mille de ces vigilants
Dans mon esprit, même si elle était au premier plan dans le mien, l’énigme était : à quel point ils
compris de nous. ont-ils compris que nous, par millions, étions
organisé, discipliné, travaillant ensemble ? ou ont-ils interprété notre
des jets de feu, le picotement soudain de nos obus, notre
investissement de leur campement, comme on le ferait de la furieuse unanimité des
assaut dans une ruche d’abeilles perturbée ? ont-ils rêvé qu'ils pourraient
nous exterminer ? (à cette époque, personne ne savait de quelle nourriture ils avaient besoin.)
des centaines de questions de ce type se bousculaient dans mon esprit alors que je regardais ça
vaste forme de sentinelle. et au fond de mon esprit se trouvait le sens de tout
les énormes forces inconnues et cachées vers Londres. avaient-ils préparé
des pièges ? les moulins à poudre d'Hounslow étaient-ils prêts à servir de piège ? est-ce que le
les londoniens ont le cœur et le courage de faire de leur Moscou un plus grand
puissante province de maisons ?","sans doute, la pensée qui préoccupait la plupart de ces cerveaux
vigilants, de même qu’elle était ma seule perplexité, était cette
énigmatique question de savoir ce que les marsiens comprenaient de nous.
se rendaient-ils compte que nos millions d’individus étaient organisés,
disciplinés, unis pour la même œuvre? ou bien, interprétaient-ils ces
jaillissements de flamme, les vols soudains de nos obus,
l’investissement régulier de leur campement, comme nous pourrions
interpréter, dans une ruche d’abeilles dérangée, un furieux et unanime
assaut? (a ce moment personne ne savait quel genre de nourriture il leur
fallait.) cent questions de ce genre se pressaient en mon esprit, tandis
que je contemplais ce plan de bataille. au fond de moi-même, j’avais la
sensation rassurante de tout ce qu’il y avait de forces inconnues et
cachées derrière nous, vers londres. avait-on préparé des fosses et des
trappes? les poudrières de hounslow allaient-elles servir de piège? les
londoniens auraient-ils le courage de faire de leur immense province
d’édifices un vaste moscou en flammes?"
"then, after an interminable time, as it seemed to us, crouching and
peering through the hedge, came a sound like the distant concussion of
a gun. another nearer, and then another. and then the martian beside us
raised his tube on high and discharged it, gunwise, with a heavy report
that made the ground heave. the one towards staines answered him. there
was no flash, no smoke, simply that loaded detonation.","puis, au bout d'un temps interminable, comme il nous a semblé, accroupis et regardant à travers la haie
accroupis et regardant à travers la haie, un bruit se fit entendre, comme la lointaine
d'un canon. un autre plus proche, puis un autre. et alors le martien à côté de nous
leva son tube en l'air et le déchargea, à la manière d'une arme à feu, avec une lourde détonation
qui a fait trembler le sol. celui qui se dirigeait vers staines lui a répondu.
Il n'y a pas eu d'éclair, pas de fumée, simplement cette détonation chargée.","puis, après un temps interminable, nous semblait-il, accroupi et
regardant à travers la haie, un bruit semblable à celui d'une commotion cérébrale lointaine retentit.
une arme à feu. un autre plus près, puis un autre. et puis le martien à côté de nous
leva son tube en haut et le déchargea, avec une arme à feu, avec une lourde détonation
cela a fait soulever le sol. celui du côté de Staines lui répondit. là
Il n’y avait pas d’éclair, pas de fumée, simplement cette détonation chargée.","puis, après une interminable attente, nous sembla-t-il, pendant laquelle
nous restâmes blottis dans la haie, un son nous parvint, comme la
détonation éloignée d’un canon. un autre se fit entendre plus proche,
puis un autre encore. alors, le marsien qui se trouvait le plus près de
nous éleva son tube et le déchargea, à la manière d’un canon, avec un
bruit sourd qui fit trembler le sol. le marsien qui était près de
staines lui répondit. il n’y eut ni flammes ni fumée, rien que cette
lourde détonation."
"i was so excited by these heavy minute-guns following one another that
i so far forgot my personal safety and my scalded hands as to clamber
up into the hedge and stare towards sunbury. as i did so a second
report followed, and a big projectile hurtled overhead towards
hounslow. i expected at least to see smoke or fire, or some such
evidence of its work. but all i saw was the deep blue sky above, with
one solitary star, and the white mist spreading wide and low beneath.
and there had been no crash, no answering explosion. the silence was
restored; the minute lengthened to three.","j'étais tellement excité par ces lourdes mitraillettes qui se succédaient les unes aux autres que
de l'histoire de l'art, de l'histoire de l'art et de l'histoire de l'art, de l'histoire de l'art et de l'histoire de l'art.
de la haie et de regarder en direction de Sunbury.
et un gros projectile se dirigea vers Hounslow.
Je m'attendais au moins à voir de la fumée ou du feu, ou quelque autre
Mais tout ce que j'ai vu, c'est le ciel d'un bleu profond, avec une étoile solitaire, et le ciel blanc.
une étoile solitaire, et la brume blanche qui s'étendait au-dessous.
Et il n'y avait pas eu de crash, pas de réponse à l'explosion.
le silence se rétablit, la minute s'allongea jusqu'à trois.","j'étais tellement excité par ces mitrailleuses lourdes qui se succédaient que
jusqu'à présent, j'ai oublié ma sécurité personnelle et mes mains échaudées pour grimper
dans la haie et regarde vers Sunbury. comme je l'ai fait une seconde
détonation suivit, et un gros projectile se précipita au-dessus de nous vers
hounslow. je m'attendais au moins à voir de la fumée ou du feu, ou quelque chose du genre
preuve de son travail. mais tout ce que j'ai vu, c'était le ciel d'un bleu profond au-dessus, avec
une étoile solitaire et la brume blanche s'étendant largement et bas en dessous.
et il n'y avait eu aucun crash, aucune explosion en réponse. le silence était
restauré; la minute s'allongea jusqu'à trois.","ces décharges successives me firent une telle impression qu’oubliant
presque ma sécurité personnelle et mes mains bouillies, je me hissai
par-dessus la haie pour voir ce qui se passait du côté de sunbury. au
même moment, une seconde détonation suivit et un énorme projectile passa
en tourbillonnant au-dessus de ma tête, allant vers hounslow. je
m’attendais à voir au moins des flammes, de la fumée, quelque évidence
de l’effet de sa chute. mais je ne vis autre chose que le ciel bleu et
profond, avec une étoile solitaire, et le brouillard blanc s’étendant
large et bas à mes pieds. il n’y avait eu aucun fracas, aucune explosion
en réponse. le silence était revenu. les minutes se prolongèrent."
"what has happened? said the curate, standing up beside me.","Qu'est-ce qui s'est passé ? dit le vicaire, se levant à côté de moi.",que s'est-il passé ? dit le curé en se mettant debout à côté de moi.,qu’arrive-t-il? demanda le vicaire qui se dressa debout à côté de moi.
heaven knows! said i.,Dieu le sait ! dit-je.,Dieu sait ! dis-je.,dieu le sait! répondis-je.
"a bat flickered by and vanished. a distant tumult of shouting began and
ceased. i looked again at the martian, and saw he was now moving
eastward along the riverbank, with a swift, rolling motion.","Une chauve-souris passa et disparut. Un tumulte lointain de cris commença et cessa.
Je regardai à nouveau le martien, et je vis qu'il se déplaçait maintenant vers l'est, le long de la rive, d'un mouvement rapide et roulant.
vers l'est, le long de la rive, d'un mouvement rapide et roulant.","une chauve-souris est passée et a disparu. un lointain tumulte de cris commença et
a cessé. J'ai regardé à nouveau le martien et j'ai vu qu'il bougeait maintenant
vers l’est le long de la rive, avec un mouvement rapide et roulant.","une chauve-souris passa en voltigeant et disparut. un lointain tumulte
de cris monta et cessa. je me tournai à nouveau du côté du marsien et je
le vis qui se dirigeait à droite, au long de la rivière, de son allure
rotative si rapide."
"every moment i expected the fire of some hidden battery to spring upon
him; but the evening calm was unbroken. the figure of the martian grew
smaller as he receded, and presently the mist and the gathering night
had swallowed him up. by a common impulse we clambered higher. towards
sunbury was a dark appearance, as though a conical hill had suddenly
come into being there, hiding our view of the farther country; and
then, remoter across the river, over walton, we saw another such
summit. these hill-like forms grew lower and broader even as we stared.","A chaque instant, je m'attendais à ce que le feu d'une batterie cachée jaillisse sur lui.
Mais le calme du soir était ininterrompu. la silhouette du martien diminuait au fur et à mesure qu'il s'éloignait.
martien diminuait à mesure qu'il s'éloignait, et bientôt le brouillard et la nuit
par une impulsion commune, nous nous élevâmes plus haut.
vers Sunbury, il y avait une apparence sombre, comme si une colline conique s'était
de l'autre côté de la rivière, une colline conique s'était soudain formée, cachant la
de l'autre côté de la rivière, au-dessus de Walton, nous apercevions un autre sommet de ce genre.
Ces formes de collines s'abaissaient et s'élargissaient pendant que nous regardions.","à chaque instant, je m'attendais à ce que le feu d'une batterie cachée jaillisse
lui; mais le calme du soir restait intact. la figure du martien a grandi
plus petit à mesure qu'il s'éloignait, et bientôt la brume et la nuit qui s'approchait
l'avait englouti. par une impulsion commune, nous avons grimpé plus haut. vers
Sunbury avait une apparence sombre, comme si une colline conique avait soudainement
naître là-bas, cachant notre vue sur le pays plus lointain ; et
puis, plus loin de l'autre côté de la rivière, au-dessus de Walton, nous en avons vu un autre
sommet. ces formes ressemblant à des collines devenaient plus basses et plus larges alors même que nous regardions.","a chaque instant, je m’attendais à entendre s’ouvrir contre lui le feu
de quelque batterie cachée; mais rien ne troubla le calme du soir. la
silhouette du marsien diminuait dans l’éloignement, et bientôt la brume
et la nuit l’eurent englouti. d’une même impulsion, nous grimpâmes un
peu plus haut. vers sunbury se trouvait une forme sombre, comme si une
colline conique s’était soudain dressée, cachant à nos regards la
contrée d’au delà; puis, plus loin, sur l’autre rive au-dessus de
walton, nous aperçûmes un autre de ces sommets. pendant que nous les
examinions, ces formes coniques s’abaissèrent et s’élargirent."
"moved by a sudden thought, i looked northward, and there i perceived a
third of these cloudy black kopjes had risen.","Je regardai vers le nord et je m'aperçus qu'un tiers de ces kopjes noirs et nuageux s'étaient levés.
un tiers de ces kopjes noirs et nuageux s'était dressé.","ému par une pensée soudaine, j'ai regardé vers le nord, et là j'ai aperçu un
Un tiers de ces kopjes noirs et nuageux s'étaient levés.","mû par une pensée soudaine, je portai mes regards vers le nord, où je
vis que trois de ces nuages noirs s’élevaient."
"everything had suddenly become very still. far away to the southeast,
marking the quiet, we heard the martians hooting to one another, and
then the air quivered again with the distant thud of their guns. but
the earthly artillery made no reply.","tout était soudain devenu très calme. loin au sud-est,
marquant le calme, nous avons entendu les martiens hululer entre eux, puis l'air a de nouveau tremblé sous le bruit lointain de leurs canons.
puis l'air trembla à nouveau sous le bruit sourd et lointain de leurs canons.
l'artillerie terrestre ne répondait pas.","tout était soudain devenu très calme. très loin au sud-est,
marquant le calme, nous avons entendu les martiens se huer les uns les autres, et
puis l'air frémit de nouveau avec le bruit lointain de leurs fusils. mais
l'artillerie terrestre ne répondit pas.","une tranquillité soudaine se fit. loin vers le sud-est, faisant mieux
ressortir le calme silence, nous entendions les marsiens s’entr’
appeler avec de longs ululements; puis l’air fut ébranlé de nouveau par
les explosions éloignées de leurs tubes. mais l’artillerie terrestre ne
leur répliquait pas."
"now at the time we could not understand these things, but later i was
to learn the meaning of these ominous kopjes that gathered in the
twilight. each of the martians, standing in the great crescent i have
described, had discharged, by means of the gunlike tube he carried, a
huge canister over whatever hill, copse, cluster of houses, or other
possible cover for guns, chanced to be in front of him. some fired only
one of these, some two—as in the case of the one we had seen; the one
at ripley is said to have discharged no fewer than five at that time.
these canisters smashed on striking the ground—they did not explode—and
incontinently disengaged an enormous volume of heavy, inky vapour,
coiling and pouring upward in a huge and ebony cumulus cloud, a gaseous
hill that sank and spread itself slowly over the surrounding country.
and the touch of that vapour, the inhaling of its pungent wisps, was
death to all that breathes.","à l'époque, nous ne pouvions pas comprendre ces choses, mais plus tard, je devais apprendre la signification de ces kopjes menaçants qui s'amoncelaient dans le ciel.
plus tard, je devais apprendre la signification de ces kopjes sinistres qui s'amoncelaient dans le crépuscule.
chacun des martiens, debout dans le grand croissant que j'ai décrit, avait déchargé, au moyen d'un tube semblable à un
décrit, avait déchargé, au moyen du tube semblable à un fusil qu'il portait, une
sur n'importe quelle colline, bosquet, groupe de maisons, ou autre
de l'homme, de la femme, de l'homme, de l'homme, de l'homme, de l'homme, de l'homme, de l'homme, de l'homme, de l'homme, de l'homme, de l'homme, de l'homme
un seul de ces canons, d'autres deux - comme c'était le cas de celui que nous avions vu ; on dit que celui de
On dit que celui de Ripley en a tiré pas moins de cinq à ce moment-là.
ces bidons se sont écrasés en touchant le sol - ils n'ont pas explosé - et ont incontinent dégagé une énorme quantité d'eau.
et dégageaient incontinent un énorme volume de vapeurs lourdes, encrassées,
s'enroulant et se déversant vers le haut en un énorme cumulus d'ébène, une colline gazeuse qui s'enfonçait et s'étalait lentement.
qui s'enfonçait et s'étendait lentement sur le pays environnant.
et le contact de cette vapeur, l'inhalation de ses volutes âcres, c'était la mort pour tout ce qui respire.
la mort pour tout ce qui respire.","maintenant, à l'époque, nous ne pouvions pas comprendre ces choses, mais plus tard, j'étais
pour apprendre la signification de ces sinistres kopjes rassemblés dans le
crépuscule. chacun des martiens, debout dans le grand croissant que j'ai
décrit, avait déchargé, au moyen du tube en forme de pistolet qu'il portait, un
énorme bidon au-dessus d'une colline, d'un bosquet, d'un groupe de maisons ou autre
possibilité de couverture pour les armes, se trouvant par hasard devant lui. certains ont tiré seulement
un de ceux-ci, quelques deux, comme dans le cas de celui que nous avions vu ; celui
On dit que chez Ripley, pas moins de cinq personnes en furent libérées à ce moment-là.
ces bidons se sont brisés en heurtant le sol — ils n'ont pas explosé — et
dégagea incontinent un énorme volume de vapeur lourde et d'encre,
s'enroulant et se déversant vers le haut dans un énorme cumulus ébène, un gaz
colline qui s'affaissa et s'étendit lentement sur le pays environnant.
et le contact de cette vapeur, l'inhalation de ses volutes piquantes, étaient
mort à tout ce qui respire.","il nous était impossible, alors, de comprendre ces choses, mais je
devais, plus tard, apprendre la signification de ces sinistres kopjes
qui s’amoncelaient dans le crépuscule. chacun des marsiens, placé ainsi
que je l’ai indiqué et obéissant à quelque signal inconnu, avait
déchargé, au moyen du tube en forme de canon qu’il portait, une sorte
d’immense obus sur tout taillis, coteau ou groupe de maisons, sur tout
autre possible abri à canons, qui se trouvait en face de lui.
quelques-uns ne tirèrent qu’un seul de ces projectiles, d’autres, deux,
comme dans le cas de celui que nous avions vu; celui de ripley n’en
déchargea, prétendit-on, pas moins de cinq, coup sur coup. ces
projectiles se brisaient en touchant le sol sans faire explosion et
immédiatement dégageaient un énorme volume d’une vapeur lourde et noire,
se déroulant et se répandant vers le ciel, en un immense nuage sombre,
une colline gazeuse qui s’écroulait et s’étendait d’elle-même sur la
contrée environnante. le contact de cette vapeur et l’inspiration de ses
âcres nuages étaient la mort pour tout ce qui respire."
