original english paragraphs,deepl paragraphs,google paragraphs,human-translated paragraphs
"Now at the time we could not understand these things, but later I was to learn the meaning of these ominous kopjes that gathered in the twilight. Each of the Martians, standing in the great crescent I have described, had discharged, by means of the gunlike tube he carried, a huge canister over whatever hill, copse, cluster of houses, or other possible cover for guns, chanced to be in front of him. Some fired only one of these, some two—as in the case of the one we had seen; the one at Ripley is said to have discharged no fewer than five at that time. These canisters smashed on striking the ground—they did not explode—and incontinently disengaged an enormous volume of heavy, inky vapour, coiling and pouring upward in a huge and ebony cumulus cloud, a gaseous hill that sank and spread itself slowly over the surrounding country. And the touch of that vapour, the inhaling of its pungent wisps, was death to all that breathes.","A l'époque, nous ne pouvions pas comprendre ces choses, mais plus tard, je devais apprendre la signification de ces kopjes inquiétants qui s'amoncelaient au crépuscule. Chacun des Martiens, debout dans le grand croissant que j'ai décrit, avait déchargé, au moyen du tube semblable à un canon qu'il portait, un énorme bidon sur n'importe quelle colline, bosquet, groupe de maisons ou autre couverture possible pour des canons, qui se trouvait par hasard devant lui. Certains ne tiraient qu'un seul de ces bidons, d'autres deux - comme c'était le cas de celui que nous avions vu ; celui de Ripley aurait déchargé pas moins de cinq bidons à ce moment-là. Ces bidons s'écrasèrent en touchant le sol - ils n'explosèrent pas - et dégagèrent incontinent un énorme volume de vapeur lourde, d'encre, s'enroulant et se déversant vers le haut en un énorme cumulus d'ébène, une colline gazeuse qui s'enfonça et s'étendit lentement sur le pays environnant. Le contact de cette vapeur, l'inhalation de ses volutes âcres, était synonyme de mort pour tout ce qui respire.","À l’époque, nous ne pouvions pas comprendre ces choses, mais plus tard, je devais apprendre la signification de ces kopjes menaçants qui se rassemblaient au crépuscule. Chacun des Martiens, debout dans le grand croissant que j'ai décrit, avait tiré, au moyen du tube en forme de fusil qu'il portait, une énorme cartouche sur n'importe quelle colline, bosquet, groupe de maisons ou autre abri possible pour les armes à feu, qui se trouvait par hasard dans le grand croissant que j'ai décrit. devant lui. Certains n'en tirèrent qu'un seul, d'autres deux, comme dans le cas de celui que nous avions vu ; celui de Ripley en aurait libéré pas moins de cinq à cette époque. Ces cartouches se brisèrent en frappant le sol - elles n'explosèrent pas - et dégageèrent incontinent un énorme volume de vapeur lourde et d'encre, s'enroulant et se déversant vers le haut en un immense cumulus ébène, une colline gazeuse qui s'enfonçait et se répandait lentement sur le pays environnant. . Et le contact de cette vapeur, l’inhalation de ses volutes âcres, étaient la mort de tout ce qui respire.","Il nous était impossible, alors, de comprendre ces choses, mais je devais, plus tard, apprendre la signification de ces sinistres kopjes qui s’amoncelaient dans le crépuscule. Chacun des Marsiens, placé ainsi que je l’ai indiqué et obéissant à quelque signal inconnu, avait déchargé, au moyen du tube en forme de canon qu’il portait, une sorte d’immense obus sur tout taillis, coteau ou groupe de maisons, sur tout autre possible abri à canons, qui se trouvait en face de lui. Quelques-uns ne tirèrent qu’un seul de ces projectiles, d’autres, deux, comme dans le cas de celui que nous avions vu; celui de Ripley n’en déchargea, prétendit-on, pas moins de cinq, coup sur coup. Ces projectiles se brisaient en touchant le sol sans faire explosion et immédiatement dégageaient un énorme volume d’une vapeur lourde et noire, se déroulant et se répandant vers le ciel, en un immense nuage sombre, une colline gazeuse qui s’écroulait et s’étendait d’elle-même sur la contrée environnante. Le contact de cette vapeur et l’inspiration de ses âcres nuages étaient la mort pour tout ce qui respire."
"It was heavy, this vapour, heavier than the densest smoke, so that, after the first tumultuous uprush and outflow of its impact, it sank down through the air and poured over the ground in a manner rather liquid than gaseous, abandoning the hills, and streaming into the valleys and ditches and watercourses even as I have heard the carbonic-acid gas that pours from volcanic clefts is wont to do. And where it came upon water some chemical action occurred, and the surface would be instantly covered with a powdery scum that sank slowly and made way for more. The scum was absolutely insoluble, and it is a strange thing, seeing the instant effect of the gas, that one could drink without hurt the water from which it had been strained. The vapour did not diffuse as a true gas would do. It hung together in banks, flowing sluggishly down the slope of the land and driving reluctantly before the wind, and very slowly it combined with the mist and moisture of the air, and sank to the earth in the form of dust. Save that an unknown element giving a group of four lines in the blue of the spectrum is concerned, we are still entirely ignorant of the nature of this substance.","Elle était lourde, cette vapeur, plus lourde que la fumée la plus dense, de sorte qu'après les premiers jets tumultueux de son impact, elle s'enfonçait dans l'air et se répandait sur le sol d'une manière plus liquide que gazeuse, abandonnant les collines et s'écoulant dans les vallées, les fossés et les cours d'eau, tout comme, d'après ce que j'ai entendu dire, le gaz acide carbonique qui s'écoule des fissures volcaniques a l'habitude de le faire. Lorsqu'il atteignait l'eau, une action chimique se produisait et la surface était instantanément recouverte d'une écume poudreuse qui coulait lentement et laissait place à d'autres. L'écume était absolument insoluble, et il est étrange, vu l'effet instantané du gaz, que l'on puisse boire sans dommage l'eau d'où il avait été extrait. La vapeur ne s'est pas diffusée comme l'aurait fait un vrai gaz. Elle s'est accumulée en bancs, s'écoulant paresseusement le long de la pente du terrain et poussant à contrecœur devant le vent, et très lentement elle s'est combinée avec la brume et l'humidité de l'air, et a coulé sur la terre sous forme de poussière. Si ce n'est qu'il s'agit d'un élément inconnu donnant un groupe de quatre raies dans le bleu du spectre, nous ignorons encore tout de la nature de cette substance.","Elle était lourde, cette vapeur, plus lourde que la fumée la plus dense, de sorte que, après le premier soulèvement et écoulement tumultueux de son impact, elle s'enfonçait dans les airs et se déversait sur le sol d'une manière plutôt liquide que gazeuse, abandonnant les collines. et se déversant dans les vallées, les fossés et les cours d'eau, comme j'ai entendu dire que le gaz carbonique qui s'écoule des fentes volcaniques a l'habitude de le faire. Et là où elle tombait sur l'eau, une action chimique se produisait, et la surface était instantanément recouverte d'une écume poudreuse qui coulait lentement et laissait place à davantage. L'écume était absolument insoluble, et c'est une chose étrange, vu l'effet instantané du gaz, qu'on puisse boire sans dommage l'eau dont on l'avait filtrée. La vapeur ne se diffusait pas comme le ferait un vrai gaz. Ils pendaient ensemble en berges, coulaient lentement le long de la pente du terrain et se déplaçaient à contrecœur sous le vent, et très lentement, ils se combinaient avec la brume et l'humidité de l'air et coulaient sur la terre sous forme de poussière. Hormis qu'il s'agit d'un élément inconnu donnant un groupe de quatre raies dans le bleu du spectre, nous ignorons encore totalement la nature de cette substance.","Cette vapeur était très lourde, plus lourde que la fumée la plus dense, si bien qu’après le premier dégagement tumultueux, elle se répandait dans les couches d’air inférieures et retombait sur le sol d’une façon plutôt liquide que gazeuse, abandonnant les collines, pénétrant dans les vallées, les fossés, au long des cours d’eau, ainsi que fait, dit-on, le gaz acide carbonique s’échappant des fissures des roches volcaniques. Partout où elle venait en contact avec l’eau, quelque action chimique se produisait; la surface se couvrait instantanément d’une sorte de lie poudreuse qui s’enfonçait lentement, laissant se former d’autres couches. Cette espèce d’écume était absolument insoluble, et il est étrange que, le gaz produisant un effet aussi immédiat, on ait pu boire sans danger l’eau dont on l’avait extraite. La vapeur ne se diffusait pas comme le font ordinairement les gaz. Elle flottait par nuages compacts, descendant paresseusement les pentes et récalcitrante au vent; elle se combinait très lentement avec la brume et l’humidité de l’air, et tombait sur le sol en forme de poussière. Sauf en ce qui concerne un élément inconnu, donnant un groupe de quatre lignes dans le bleu du spectre, on ignore encore entièrement la nature de cette substance."
"Once the tumultuous upheaval of its dispersion was over, the black smoke clung so closely to the ground, even before its precipitation, that fifty feet up in the air, on the roofs and upper stories of high houses and on great trees, there was a chance of escaping its poison altogether, as was proved even that night at Street Cobham and Ditton.","Une fois terminé le tumulte de sa dispersion, la fumée noire s'accrochait si étroitement au sol, même avant sa précipitation, qu'à cinquante pieds d'altitude, sur les toits et les étages supérieurs des hautes maisons et sur les grands arbres, il y avait une chance d'échapper complètement à son poison, comme cela a été prouvé même cette nuit-là à Street Cobham et Ditton.","Une fois passé le bouleversement tumultueux de sa dispersion, la fumée noire s'accrochait si étroitement au sol, avant même sa précipitation, qu'à cinquante pieds de hauteur, sur les toits et les étages des hautes maisons et sur les grands arbres, il y avait une chance d'échapper complètement à son poison, comme cela fut prouvé même cette nuit-là à Street Cobham et Ditton.","Lorsque le tumultueux soulèvement de sa dispersion était terminé, la fumée noire se tassait tout contre le sol, avant même sa précipitation en poussière, si bien qu’à cinquante pieds en l’air, sur les toits, aux étages supérieurs des hautes maisons et sur les grands arbres, il y avait quelque chance d’échapper à l’empoisonnement, comme les faits le prouvèrent ce soir-là à Street Cobham et à Ditton."
"The man who escaped at the former place tells a wonderful story of the strangeness of its coiling flow, and how he looked down from the church spire and saw the houses of the village rising like ghosts out of its inky nothingness. For a day and a half he remained there, weary, starving and sun-scorched, the earth under the blue sky and against the prospect of the distant hills a velvet-black expanse, with red roofs, green trees, and, later, black-veiled shrubs and gates, barns, outhouses, and walls, rising here and there into the sunlight.","L'homme qui s'est échappé à l'ancien endroit raconte une histoire merveilleuse sur l'étrangeté de son flux sinueux, et comment il a regardé du haut de la flèche de l'église et a vu les maisons du village surgir comme des fantômes de ce néant d'encre. Il resta là un jour et demi, épuisé, affamé et brûlé par le soleil, la terre sous le ciel bleu et face à la perspective des collines lointaines étant une étendue noire et veloutée, avec des toits rouges, des arbres verts et, plus tard, des arbustes voilés de noir et des portes, des granges, des toilettes extérieures et des murs s'élevant çà et là dans la lumière du soleil.","L'homme qui s'est échappé à l'ancien endroit raconte une histoire merveilleuse sur l'étrangeté de son flux sinueux, et comment il a regardé du haut du clocher de l'église et a vu les maisons du village s'élever comme des fantômes hors de son néant d'encre. Pendant un jour et demi, il resta là, fatigué, affamé et brûlé par le soleil, la terre sous le ciel bleu et, sur le fond des collines lointaines, une étendue d'un noir de velours, avec des toits rouges, des arbres verts et, plus tard, des arbres noirs. - des buissons et des portes voilées, des granges, des dépendances et des murs, s'élevant ici et là dans la lumière du soleil.","L’homme qui échappa à la suffocation dans le premier de ces villages fit un étonnant récit de l’étrangeté de ces volutes et de ces replis; il raconta comment, du haut du clocher de l’église, il vit les maisons du village ressurgir peu à peu, hors de ce néant noirâtre, ainsi que des fantômes. Il resta là pendant un jour et demi, épuisé, mourant de faim et de soif, écorché par le soleil, voyant à ses pieds la terre sous le ciel bleu, et contre le fond des collines lointaines, une étendue recouverte comme d’un velours noir, avec des toits rouges, des arbres verts, puis, plus tard, des haies, des buissons, des granges, des remises, des murs voilés de noir, se dressant ici et là dans le soleil."
"But that was at Street Cobham, where the black vapour was allowed to remain until it sank of its own accord into the ground. As a rule the Martians, when it had served its purpose, cleared the air of it again by wading into it and directing a jet of steam upon it.","Mais c'était à Street Cobham, où la vapeur noire était autorisée à rester jusqu'à ce qu'elle s'enfonce d'elle-même dans le sol. En règle générale, lorsque la vapeur noire avait atteint son but, les Martiens en débarrassaient l'air en y plongeant et en dirigeant un jet de vapeur sur elle.","Mais c'était dans la rue Cobham, où la vapeur noire pouvait rester jusqu'à ce qu'elle s'enfonce d'elle-même dans le sol. En règle générale, les Martiens, lorsqu'ils avaient rempli leur fonction, en purifiaient l'air à nouveau en y pénétrant à gué et en dirigeant un jet de vapeur sur lui.","Ceci se passait à Street Cobham, où la fumée noire resta jusqu’à ce qu’elle se fût absorbée d’elle-même dans le sol. Ordinairement, dès qu’elle avait rempli son objet, les Marsiens en débarrassaient l’atmosphère au moyen de jets de vapeur."
"This they did with the vapour banks near us, as we saw in the starlight from the window of a deserted house at Upper Halliford, whither we had returned. From there we could see the searchlights on Richmond Hill and Kingston Hill going to and fro, and about eleven the windows rattled, and we heard the sound of the huge siege guns that had been put in position there. These continued intermittently for the space of a quarter of an hour, sending chance shots at the invisible Martians at Hampton and Ditton, and then the pale beams of the electric light vanished, and were replaced by a bright red glow.","C'est ce qu'ils ont fait avec les bancs de vapeur près de nous, comme nous l'avons vu à la lumière des étoiles depuis la fenêtre d'une maison abandonnée à Upper Halliford, où nous étions retournés. De là, nous pouvions voir les projecteurs de Richmond Hill et de Kingston Hill aller et venir, et vers onze heures, les fenêtres ont tremblé et nous avons entendu le bruit des énormes canons de siège qui avaient été mis en place à cet endroit. Ceux-ci ont continué à fonctionner par intermittence pendant un quart d'heure, tirant par hasard sur les Martiens invisibles de Hampton et de Ditton, puis les pâles faisceaux de la lumière électrique ont disparu et ont été remplacés par une vive lueur rouge.","C'est ce qu'ils firent avec les bancs de vapeur près de nous, comme nous le vîmes à la lumière des étoiles depuis la fenêtre d'une maison déserte d'Upper Halliford, où nous étions retournés. De là, nous pouvions voir les projecteurs de Richmond Hill et de Kingston Hill aller et venir, et vers onze heures les fenêtres claquaient, et nous entendions le bruit des énormes canons de siège qui avaient été placés là. Celles-ci ont continué par intermittence pendant l'espace d'un quart d'heure, envoyant des tirs aléatoires sur les Martiens invisibles à Hampton et Ditton, puis les pâles faisceaux de la lumière électrique ont disparu et ont été remplacés par une lueur rouge vif.","C’est ce qu’ils firent avec les couches qui s’étaient déroulées auprès de nous, comme nous pûmes le voir à la lueur des étoiles, derrière les fenêtres d’une maison déserte d’Upper Halliford, où nous étions retournés. De là, aussi, nous apercevions les feux électriques des collines de Richmond et de Kingston, fouillant la nuit en tout sens; puis vers onze heures les vitres résonnèrent et nous entendîmes les détonations des grosses pièces de siège qu’on avait mises en batterie sur ces hauteurs. La canonnade continua par intervalles réguliers, pendant l’espace d’un quart d’heure, envoyant au hasard des projectiles contre les Marsiens invincibles, à Hampton et à Ditton; puis les rayons pâles des feux électriques s’évanouirent et furent remplacés par de vifs reflets rouges."
"Then the fourth cylinder fell—a brilliant green meteor—as I learned afterwards, in Bushey Park. Before the guns on the Richmond and Kingston line of hills began, there was a fitful cannonade far away in the southwest, due, I believe, to guns being fired haphazard before the black vapour could overwhelm the gunners.","Puis le quatrième cylindre tomba - un météore vert brillant - comme je l'appris par la suite, à Bushey Park. Avant que les canons de la ligne des collines de Richmond et Kingston ne se mettent en marche, il y eut une canonnade irrégulière au loin dans le sud-ouest, due, je crois, au fait que les canons furent tirés au hasard avant que la vapeur noire ne puisse submerger les artilleurs.","Puis le quatrième cylindre est tombé – un météore vert brillant – comme je l'ai appris plus tard, à Bushey Park. Avant le début des tirs sur la ligne de collines de Richmond et de Kingston, il y eut une cannonade intermittente loin dans le sud-ouest, due, je crois, au fait que les canons tiraient au hasard avant que la vapeur noire ne puisse submerger les artilleurs.","Alors le quatrième cylindre météore d’un vert brillant tomba dans Bushey Park, ainsi que je l’appris plus tard. Avant que l’artillerie des collines de Richmond et de Kingston n’ait ouvert le feu, une violente canonnade se fit entendre au lointain, vers le sud-ouest, due, je pense, à des batteries qui tiraient à l’aventure, avant que la fumée noire ne submergeât les canonniers."
"So, setting about it as methodically as men might smoke out a wasps’ nest, the Martians spread this strange stifling vapour over the Londonward country. The horns of the crescent slowly moved apart, until at last they formed a line from Hanwell to Coombe and Malden. All night through their destructive tubes advanced. Never once, after the Martian at St. George’s Hill was brought down, did they give the artillery the ghost of a chance against them. Wherever there was a possibility of guns being laid for them unseen, a fresh canister of the black vapour was discharged, and where the guns were openly displayed the Heat-Ray was brought to bear.","C'est ainsi que les Martiens, avec autant de méthode qu'un homme pour éliminer un nid de guêpes, ont répandu cette étrange vapeur étouffante sur le pays londonien. Les cornes du croissant s'éloignèrent lentement, jusqu'à former une ligne allant de Hanwell à Coombe et Malden. Toute la nuit, leurs tubes destructeurs avancèrent. George's Hill, ils ne laissèrent jamais à l'artillerie la moindre chance de s'opposer à eux. Chaque fois qu'il y avait une possibilité que des canons soient posés pour eux sans être vus, une nouvelle cartouche de vapeur noire était déchargée, et là où les canons étaient ouvertement exposés, le Rayon de Chaleur était mis en œuvre.","Ainsi, s’y prenant avec autant de méthode que les hommes pourraient fumer un nid de guêpes, les Martiens répandirent cette étrange vapeur étouffante sur la campagne londonienne. Les cornes du croissant s'écartèrent lentement, jusqu'à former enfin une ligne allant de Hanwell à Coombe et Malden. Toute la nuit, ils ont avancé à travers leurs tubes destructeurs. Jamais, après la destruction du Martien de St. George’s Hill, ils n’ont donné à l’artillerie l’ombre d’une chance contre eux. Partout où il y avait une possibilité que des armes soient posées à leur intention, une nouvelle cartouche de vapeur noire était déchargée, et là où les armes étaient ouvertement exposées, le Heat-Ray était utilisé.","Ainsi, de la même façon méthodique que les hommes emploient pour enfumer un nid de guêpes, les Marsiens recouvraient toute la contrée, vers Londres, de cette étrange vapeur suffocante. La courbe de leur ligne s’étendait lentement et elle atteignit bientôt, d’un côté, Hanwell et de l’autre Coombe et Malden. Toute la nuit, leurs tubes destructeurs furent à l’œuvre. Pas une seule fois, après que le Marsien de St George’s Hill eut été abattu, ils ne s’approchèrent à portée de l’artillerie. Partout où ils supposaient que pouvaient être dissimulés des canons, ils envoyaient un projectile contenant leur vapeur noire, et quand les batteries étaient en vue, ils pointaient simplement le Rayon Ardent."
"By midnight the blazing trees along the slopes of Richmond Park and the glare of Kingston Hill threw their light upon a network of black smoke, blotting out the whole valley of the Thames and extending as far as the eye could reach. And through this two Martians slowly waded, and turned their hissing steam jets this way and that.","À minuit, les arbres en feu le long des pentes de Richmond Park et l'éclat de Kingston Hill jetaient leur lumière sur un réseau de fumée noire qui recouvrait toute la vallée de la Tamise et s'étendait aussi loin que l'œil pouvait atteindre. Deux Martiens s'y faufilaient lentement et faisaient tourner leurs jets de vapeur sifflants dans tous les sens.","Vers minuit, les arbres flamboyants le long des pentes de Richmond Park et l'éclat de Kingston Hill jetaient leur lumière sur un réseau de fumée noire, masquant toute la vallée de la Tamise et s'étendant à perte de vue. Et à travers cela, deux Martiens pataugeaient lentement, et faisaient tourner leurs jets de vapeur sifflants d'un côté et de l'autre.","Vers minuit, les arbres en flammes sur les pentes de Richmond Park, et les incendies de Kingston Hill éclairèrent un réseau de fumée noire qui cachait toute la vallée de la Tamise et s’étendait aussi loin que l’œil pouvait voir. A travers cette confusion, s’avançaient deux Marsiens qui dirigeaient en tous sens leurs bruyants jets de vapeur."
