original english paragraphs,deepl paragraphs,google paragraphs,human-translated paragraphs
"the intense excitement of the events had no doubt left my perceptive
powers in a state of erethism. i remember that dinner table with
extraordinary vividness even now. my dear wife’s sweet anxious face
peering at me from under the pink lamp shade, the white cloth with its
silver and glass table furniture—for in those days even philosophical
writers had many little luxuries—the crimson-purple wine in my glass,
are photographically distinct. at the end of it i sat, tempering nuts
with a cigarette, regretting ogilvy’s rashness, and denouncing the
short-sighted timidity of the martians.","l'excitation intense des événements avait sans doute laissé mes capacités de perception dans un état d'éréthisme.
dans un état d'éréthisme. je me souviens encore aujourd'hui de ce dîner avec une
le doux visage anxieux de ma chère femme qui me regardait sous l'abat-jour rose, la nappe blanche avec ses
sous l'abat-jour rose, la nappe blanche et les meubles de table en argent et en verre
de table en argent et en verre - à l'époque, même les écrivains philosophes
de luxe, le vin cramoisi et pourpre dans mon verre,
Je me suis assis à la fin, tempérant les noix avec une cigarette, regrettant de n'avoir pas eu le temps d'aller à l'école.
avec une cigarette, regrettant la témérité d'Ogilvy et dénonçant la timidité
la timidité à courte vue des martiens.","l'intense excitation des événements avait sans doute laissé ma perspicacité
pouvoirs en état d’éréthisme. je me souviens de cette table à dîner avec
une vivacité extraordinaire, même maintenant. le doux visage anxieux de ma chère épouse
me regardant sous l'abat-jour rose, le tissu blanc avec son
des meubles de table en argent et en verre, car à cette époque même les philosophes
les écrivains avaient de nombreux petits luxes : le vin pourpre pourpre dans mon verre,
sont photographiquement distincts. à la fin, je me suis assis, tempérant des noix
avec une cigarette, regrettant l’imprudence d’Ogilvy et dénonçant
timidité myope des martiens.","l’intense surexcitation des événements avait sans aucun doute laissé mes
facultés perceptives en état d’éréthisme. maintenant encore, je me
rappelle avec une extraordinaire vivacité ce dîner. la figure douce et
anxieuse de ma femme tournée vers moi, sous l’abat-jour rose, la nappe
blanche avec l’argenterie et la verrerie car, en ces jours-là, même
les écrivains philosophiques se permettaient maints petits luxes le vin
pourpre dans mon verre, tous ces détails sont photographiquement
distincts. au dessert, je m’attardai, combinant le goût des noix à une
cigarette, regrettant l’imprudence d’ogilvy et déplorant la peu
clairvoyante pusillanimité des marsiens."
"so some respectable dodo in the mauritius might have lorded it in his
nest, and discussed the arrival of that shipful of pitiless sailors in
want of animal food. we will peck them to death tomorrow, my dear.","de l'île Maurice aurait pu rester dans son nid et discuter de l'arrivée de ces
nid, et discuter de l'arrivée de cette bande de marins impitoyables en manque de nourriture animale.
de nourriture animale. nous les becqueterons à mort demain, ma chère.","donc un dodo respectable à Maurice aurait pu le régner dans son
nid, et discuta de l'arrivée de ce navire de marins impitoyables dans
manque de nourriture pour animaux. nous les picorerons à mort demain, ma chère.","ainsi quelque respectable dodo de l’île maurice aurait pu, de son nid,
envisager de cette façon les circonstances et, discutant l’arrivée d’un
navire en quête de nourriture animale, aurait dit: nous les mettrons à
mort à coups de bec, demain, ma chère!"
"i did not know it, but that was the last civilised dinner i was to eat
for very many strange and terrible days.","Je ne le savais pas, mais c'était le dernier dîner civilisé que je devais prendre avant de nombreux jours étranges et terribles.
pour de nombreux jours étranges et terribles.","je ne le savais pas, mais c'était le dernier dîner civilisé que je devais manger
pendant de très nombreux jours étranges et terribles.","sans le savoir, c’était le dernier dîner civilisé que je devais faire
pendant d’étranges et terribles jours."
"the most extraordinary thing to my mind, of all the strange and
wonderful things that happened upon that friday, was the dovetailing of
the commonplace habits of our social order with the first beginnings of
the series of events that was to topple that social order headlong. if
on friday night you had taken a pair of compasses and drawn a circle
with a radius of five miles round the woking sand-pits, i doubt if you
would have had one human being outside it, unless it were some relation
of stent or of the three or four cyclists or london people lying dead
on the common, whose emotions or habits were at all affected by the
new-comers. many people had heard of the cylinder, of course, and
talked about it in their leisure, but it certainly did not make the
sensation that an ultimatum to germany would have done.","la chose la plus extraordinaire à mes yeux, de toutes les choses étranges et merveilleuses qui se sont produites ce vendredi-là, c'est la concordance entre les deux.
ce vendredi-là, c'est la concordance entre les habitudes banales de notre ordre social et les premières
de notre ordre social avec les prémices de la série d'événements qui allaient
de la série d'événements qui allaient faire basculer cet ordre social.
vendredi soir, vous aviez pris un compas et tracé un cercle d'un rayon de cinq milles autour de l'église.
rayon de cinq miles autour des sablières de Woking, je doute qu'il y ait eu un seul être humain à l'extérieur de ce cercle.
de l'homme en dehors de ce cercle, a moins qu'il ne s'agisse d'un parent de
de stent ou des trois ou quatre cyclistes ou londoniens gisant morts sur le common, dont les
de l'histoire de la France et de l'Europe, de la France et de l'Europe, de l'Europe et de l'Europe, de l'Europe et de l'Europe.
de l'histoire de l'art, de l'histoire de la culture, de l'histoire de l'art, de l'histoire de l'art, de l'histoire de l'art.
et en parlaient pendant leurs loisirs, mais cela n'a certainement pas fait la
l'ultimatum à l'Allemagne.","la chose la plus extraordinaire à mon avis, de toutes les choses étranges et
les choses merveilleuses qui se sont produites ce vendredi-là, c'est la conjonction de
les habitudes banales de notre ordre social avec les premiers débuts de
la série d’événements qui allaient bouleverser cet ordre social de plein fouet. si
vendredi soir, tu avais pris un compas et dessiné un cercle
avec un rayon de cinq milles autour des sablières en activité, je doute que vous
aurait eu un être humain à l'extérieur, à moins qu'il n'y ait eu une relation
du stent ou des trois ou quatre cyclistes ou londoniens gisant morts
sur le commun, dont les émotions ou les habitudes étaient affectées par le
nouveaux arrivants. bien sûr, beaucoup de gens avaient entendu parler du cylindre, et
en parlaient pendant leurs loisirs, mais cela n'a certainement pas fait l'affaire.
sensation qu'un ultimatum lancé à l'Allemagne aurait produit.","de toutes les choses surprenantes et merveilleuses qui arrivèrent ce
vendredi-là, la plus étrange à mon esprit fut la combinaison des
habitudes ordinaires et banales de notre ordre social avec les premiers
débuts de la série d’événements qui devaient jeter à bas ce même ordre
social. si, le vendredi soir, prenant un compas, vous eussiez décrit un
cercle d’un rayon de cinq milles autour des carrières de woking, il est
douteux que vous ayez pu trouver, en dehors de cet espace, un seul être
humain à moins que ce ne fût quelque parent de stent, ou des trois ou
quatre cyclistes et des gens venus de londres dont les cadavres étaient
demeurés sur la lande qui eût été en rien affecté dans ses émotions et
ses habitudes par les nouveaux venus. beaucoup de gens, certes, avaient
entendu parler du cylindre, en avaient même causé à leurs moments de
loisir, mais cela n’avait certainement pas produit la sensation
qu’aurait soulevée un ultimatum à l’allemagne."
"in london that night poor henderson’s telegram describing the gradual
unscrewing of the shot was judged to be a canard, and his evening
paper, after wiring for authentication from him and receiving no
reply—the man was killed—decided not to print a special edition.","a londres, cette nuit-la, le telegramme du pauvre henderson decrivant le descellement progressif de la balle a ete juge comme un canard et son
de l'histoire de l'art, de la culture et de l'histoire de l'art, de l'histoire de l'art, de l'histoire de l'art et de l'histoire de l'art
de son journal du soir, après avoir demandé une authentification de sa part et n'avoir reçu
l'homme avait été tué, décida de ne pas publier d'édition spéciale.","à Londres ce soir-là, le télégramme du pauvre Henderson décrivant la progression progressive
le dévissage du coup fut jugé un canard, et sa soirée
papier, après avoir effectué un câblage pour authentification de sa part et reçu aucun
La réponse - l'homme a été tué - a décidé de ne pas imprimer d'édition spéciale.","a londres, ce soir-là, le télégramme du malheureux henderson, décrivant
le dévissage graduel du projectile, fut reçu comme un canard et le
journal du soir auquel il avait été adressé ayant, sans obtenir de
réponse, télégraphié pour une confirmation de la nouvelle décida de ne
pas lancer d’édition spéciale."
"even within the five-mile circle the great majority of people were
inert. i have already described the behaviour of the men and women to
whom i spoke. all over the district people were dining and supping;
working men were gardening after the labours of the day, children were
being put to bed, young people were wandering through the lanes
love-making, students sat over their books.","même dans le cercle des cinq milles, la grande majorité des gens étaient inertes.
J'ai déjà décrit le comportement des hommes et des femmes à qui j'ai parlé.
dans tout le district, les gens dînaient et soupaient ;
les ouvriers jardinaient apres les travaux de la journee, on mettait les enfants au lit, on
les enfants se couchaient, les jeunes gens se promenaient dans les ruelles
les jeunes se promenaient dans les ruelles, faisaient l'amour, les étudiants étaient assis devant leurs livres.","même dans un cercle de huit kilomètres, la grande majorité des gens étaient
inerte. j'ai déjà décrit le comportement des hommes et des femmes
à qui j'ai parlé. dans tout le pays, on dînait et on dînait ;
les ouvriers jardinaient après le travail de la journée, les enfants
étant couchés, des jeunes déambulaient dans les ruelles
faire l'amour, les étudiants étaient assis devant leurs livres.","même dans ce cercle fictif de cinq milles, la majorité des gens
restaient indifférents. j’ai déjà décrit la conduite de ceux, hommes et
femmes, auxquels je m’étais adressé. dans tout le district, les gens
dînaient et soupaient; les ouvriers jardinaient après les travaux du
jour; on couchait les enfants; les jeunes gens erraient amoureusement
par les chemins et les savants compulsaient leurs livres."
"maybe there was a murmur in the village streets, a novel and dominant
topic in the public-houses, and here and there a messenger, or even an
eye-witness of the later occurrences, caused a whirl of excitement, a
shouting, and a running to and fro; but for the most part the daily
routine of working, eating, drinking, sleeping, went on as it had done
for countless years—as though no planet mars existed in the sky. even
at woking station and horsell and chobham that was the case.","de l'histoire, il y avait un murmure dans les rues du village, un nouveau
de l'histoire de l'art, de l'histoire de la culture, de l'histoire de l'art, de l'histoire de l'art, de l'histoire de l'art.
de l'histoire, provoquait un tourbillon d'excitation, des cris, des courses.
de l'histoire, des cris et des courses ; mais, pour l'essentiel, la routine quotidienne
de travail, de nourriture, de boisson, de sommeil, se poursuivait comme il l'avait fait
comme si la planète Mars n'existait pas dans le ciel. même à la station de
à la gare de woking, à horsell et à chobham, c'était le cas.","peut-être y avait-il un murmure dans les rues du village, un murmure nouveau et dominant
sujet dans les cabarets, et ici et là un messager, ou même un
témoin oculaire des événements ultérieurs, a provoqué un tourbillon d'excitation, un
des cris et des courses çà et là ; mais pour la plupart le quotidien
la routine consistant à travailler, manger, boire, dormir, continuait comme elle l'avait fait
pendant d'innombrables années, comme si aucune planète Mars n'existait dans le ciel. même
à la station de travail et à Horsell et Chobham, c'était le cas.","peut-être y avait-il dans les rues du village un murmure inaccoutumé; un
sujet de causerie nouveau et absorbant, dans les tavernes; ici et là un
messager, ou même un témoin des derniers incidents, occasionnait quelque
agitation, des cris et des allées et venues. mais presque partout sans
exception, la routine quotidienne: travailler, manger, boire et dormir,
continuait ainsi que depuis d’innombrables années comme si nulle
planète mars n’eût existé dans les deux. même à woking, à horsell et à
chobham, tel était le cas."
"in woking junction, until a late hour, trains were stopping and going
on, others were shunting on the sidings, passengers were alighting and
waiting, and everything was proceeding in the most ordinary way. a boy
from the town, trenching on smith’s monopoly, was selling papers with
the afternoon’s news. the ringing impact of trucks, the sharp whistle
of the engines from the junction, mingled with their shouts of men
from mars! excited men came into the station about nine o’clock with
incredible tidings, and caused no more disturbance than drunkards might
have done. people rattling londonwards peered into the darkness outside
the carriage windows, and saw only a rare, flickering, vanishing spark
dance up from the direction of horsell, a red glow and a thin veil of
smoke driving across the stars, and thought that nothing more serious
than a heath fire was happening. it was only round the edge of the
common that any disturbance was perceptible. there were half a dozen
villas burning on the woking border. there were lights in all the
houses on the common side of the three villages, and the people there
kept awake till dawn.","à woking junction, jusqu'à une heure tardive, les trains s'arrêtaient et repartaient, d'autres manœuvraient sur les voies de garage, les passagers descendaient.
de l'homme, de la femme, de l'homme, de l'homme, de l'homme, de l'homme, de l'homme, de l'homme, de l'homme, de l'homme
et les passagers descendaient et attendaient, et tout se passait de la manière la plus ordinaire.
un garçon de la ville, profitant du monopole de Smith, vendait des journaux avec les
l'après-midi. le bruit des camions, le sifflement aigu des locomotives de la jonction
des moteurs de la jonction, mêlés aux cris des hommes de mars !
des hommes de mars ! des hommes excités sont entrés dans la gare vers neuf heures avec des
de la gare avec des nouvelles incroyables, et n'ont pas causé plus de trouble que des
Les gens qui s'agitaient vers london regardaient dans l'obscurité à travers les fenêtres des wagons et ne voyaient qu'un
les fenêtres des wagons, et n'ont vu qu'une rare étincelle, vacillante, disparaissant
danser dans la direction de Horsell, une lueur rouge et un mince voile de
de fumée traversant les étoiles, et pensa qu'il n'y avait rien de plus grave qu'un
de la bruyère. ce n'est qu'au bord de la commune que l'on a perçu une
de la commune qu'une perturbation était perceptible. il y avait une demi-douzaine de
villas brûlaient à la frontière de woking. il y avait des lumières dans toutes les maisons du côté des trois
dans toutes les maisons du côté des trois villages, et les gens restaient éveillés jusqu'à l'aube.
restaient éveillés jusqu'à l'aube.","au carrefour de Woking, jusqu'à une heure tardive, les trains s'arrêtaient et partaient
d'autres faisaient des manœuvres sur les voies d'évitement, des passagers descendaient et
j'attendais, et tout se déroulait de la manière la plus ordinaire. un garçon
de la ville, attaquant le monopole de Smith, vendait des journaux avec
les nouvelles de l'après-midi. la sonnerie des camions, le sifflement aigu
des moteurs du carrefour, mêlés à leurs cris d'hommes
de mars ! des hommes excités sont entrés dans la gare vers neuf heures avec
des nouvelles incroyables et ne causèrent pas plus de troubles que les ivrognes pourraient le faire.
avoir fait. les gens qui se déplaçaient vers Londres regardaient dans l'obscurité dehors
les vitres de la voiture, et je n'ai vu qu'une rare étincelle vacillante et disparaissante
dansent en direction de Horsell, une lueur rouge et un mince voile de
de la fumée traversant les étoiles et je pensais que rien de plus grave
qu'un incendie de bruyère se produisait. c'était seulement au bord de la
Il est courant qu'une quelconque perturbation soit perceptible. il y en avait une demi-douzaine
des villas brûlent à la frontière actuelle. il y avait des lumières dans tout
maisons du côté commun des trois villages, et les gens qui s'y trouvent
resté éveillé jusqu'à l'aube.","a la gare de woking, jusqu’à une heure tardive, les trains s’arrêtaient
et repartaient, d’autres se garaient sur les voies d’évitement, les
voyageurs descendaient ou attendaient et toutes choses suivaient leur
cours ordinaire. un gamin de la ville, empiétant sur le monopole des
bibliothèques de chemin de fer, vendait sur les quais des journaux
renfermant les nouvelles de l’après-midi. le vacarme des trucks, le
sifflet aigu des locomotives, se mêlaient à ses cris de: “l’arrivée des
habitants de mars”. des groupes agités envahirent la station vers neuf
heures, racontant d’incroyables nouvelles et ne causèrent pas plus de
trouble que des ivrognes n’auraient pu faire. les gens en route vers
londres cherchaient, à travers les fenêtres des wagons, à apercevoir
quelque chose dans les ténèbres du dehors et voyaient seulement de rares
étincelles scintiller et s’élever en dansant dans la direction de
horsell, puis disparaître, une lueur rougeâtre et une mince traînée de
fumée se promener contre l’écran du ciel, et ils en concluaient que rien
n’arrivait de plus sérieux que quelque incendie dans les bruyères. ce
n’était que sur les confins de la lande qu’on pouvait voir réellement
quelque désordre. là, sur la lisière du côté de woking, une douzaine de
villas étaient en flammes. des lumières restèrent allumées dans toutes
les maisons des trois villages proches de la lande et les gens y
veillèrent jusqu’à l’aurore."
"a curious crowd lingered restlessly, people coming and going but the
crowd remaining, both on the chobham and horsell bridges. one or two
adventurous souls, it was afterwards found, went into the darkness and
crawled quite near the martians; but they never returned, for now and
again a light-ray, like the beam of a warship’s searchlight swept the
common, and the heat-ray was ready to follow. save for such, that big
area of common was silent and desolate, and the charred bodies lay
about on it all night under the stars, and all the next day. a noise of
hammering from the pit was heard by many people.","une foule curieuse s'attardait avec agitation, les gens allant et venant mais la foule restant, tant sur le pont de chobham que sur celui de horsell.
de chobham et de horsell. un ou deux aventuriers, on l'a appris par la suite, sont allés dans les
aventuriers, on l'a appris par la suite, se sont enfoncés dans l'obscurité et
et s'approchèrent des martiens, mais ils ne revinrent jamais, car de temps en temps un rayon de
de temps en temps un rayon de lumière, comme le faisceau d'un projecteur de navire de guerre, balayait la commune.
de recherche d'un navire de guerre balayait le terrain communal, et le rayon de chaleur était prêt à suivre.
de la commune était silencieuse et désolée, et les corps carbonisés y gisaient toute la
les corps carbonisés restèrent étendus toute la nuit sous les étoiles, et toute la journée du lendemain.
marteau provenant de la fosse fut entendu par de nombreuses personnes.","une foule curieuse s'attardait, agitée, les gens allaient et venaient mais le
foule restante, à la fois sur les ponts Chobham et Horsell. un ou deux
les âmes aventureuses, on l'a découvert plus tard, allaient dans l'obscurité et
rampé tout près des martiens ; mais ils ne sont jamais revenus, pour l'instant et
encore une fois, un rayon lumineux, comme le faisceau du projecteur d'un navire de guerre, balaya le
commun, et le rayon de chaleur était prêt à suivre. sauf pour tel, si gros
la zone commune était silencieuse et désolée, et les corps calcinés gisaient
j'y ai travaillé toute la nuit sous les étoiles, et toute la journée suivante. un bruit de
le martèlement de la fosse a été entendu par de nombreuses personnes.","une foule curieuse s’attardait, incessamment renouvelée, à la fois sur
le pont de chobham et sur celui de horsell. une ou deux âmes
aventureuses ainsi qu’on s’en aperçut après s’avancèrent à la faveur
des ténèbres et se faufilèrent jusqu’auprès des marsiens. mais elles ne
revinrent pas, car de temps en temps un rayon de lumière, semblable aux
feux électriques d’un vaisseau de guerre, balayait la lande et le rayon
brûlant le suivait immédiatement. a part cela, l’immense étendue demeura
silencieuse et désolée, et les corps carbonisés y restèrent épars toute
la nuit sous les étoiles et tout le jour suivant. un bruit de métal
qu’on martèle venait du cylindre et fut entendu par beaucoup de gens."
"so you have the state of things on friday night. in the centre,
sticking into the skin of our old planet earth like a poisoned dart,
was this cylinder. but the poison was scarcely working yet. around it
was a patch of silent common, smouldering in places, and with a few
dark, dimly seen objects lying in contorted attitudes here and there.
here and there was a burning bush or tree. beyond was a fringe of
excitement, and farther than that fringe the inflammation had not crept
as yet. in the rest of the world the stream of life still flowed as it
had flowed for immemorial years. the fever of war that would presently
clog vein and artery, deaden nerve and destroy brain, had still to
develop.","voilà donc l'état des choses vendredi soir. au centre,
se plantant dans la peau de notre vieille planète Terre comme une fléchette empoisonnée,
mais le poison n'avait pas encore fait son effet. autour de lui
était une étendue de terrain communal silencieux, fumant par endroits, et avec quelques objets sombres, faiblement visibles, gisant dans le sol.
objets sombres, faiblement visibles, gisant dans des attitudes tordues ici et là.
Ici et là, il y avait un buisson ou un arbre en feu.
de l'excitation, et au-dela de cette frange l'inflammation ne s'etait pas encore
dans le reste du monde, le courant de la vie continuait de couler comme il l'avait fait
la fièvre de la guerre qui allait bientôt obstruer les veines et les artères, qui allait
les veines et les artères, les nerfs et le cerveau, ne s'est pas encore développée.
se développer.","vous avez donc l'état des choses vendredi soir. au centre,
s'enfonçant dans la peau de notre vieille planète Terre comme une fléchette empoisonnée,
était ce cylindre. mais le poison n’agissait pas encore. autour de lui
était une parcelle de terrain commun silencieux, fumant par endroits, et avec quelques
des objets sombres, à peine visibles, couchés dans des attitudes contorsionnées ici et là.
ici et là il y avait un buisson ou un arbre ardent. au-delà se trouvait une frange de
l'excitation, et au-delà de cette frange, l'inflammation ne s'était pas propagée
pas encore. dans le reste du monde, le courant de la vie coulait toujours
coulait depuis des années immémoriales. la fièvre de la guerre qui allait bientôt
obstruer les veines et les artères, endormir les nerfs et détruire le cerveau, il fallait encore
développer.","tel était l’état des choses ce vendredi soir. au centre, enfoncé dans la
peau de notre vieille planète comme une écharde empoisonnée, était ce
cylindre. mais le poison avait à peine commencé son œuvre. autour de lui
s’étendait la lande silencieuse, mal éteinte par places, avec quelques
objets sombres, à peine visibles, gisant en attitudes contorsionnées ici
et là. de distance en distance un arbre ou un buisson brûlait encore.
plus loin, c’était comme une frontière d’activité au delà de laquelle
les flammes n’étaient pas encore parvenues. dans le reste du monde, le
cours de la vie allait son train comme depuis d’immémoriales années. la
fièvre de la lutte, qui allait bientôt venir obstruer les veines et les
artères, user les nerfs et détruire les cerveaux, était latente encore."
