original english paragraphs,deepl paragraphs,google paragraphs,human-translated paragraphs
"when i returned to the common the sun was setting. scattered groups
were hurrying from the direction of woking, and one or two persons were
returning. the crowd about the pit had increased, and stood out black
against the lemon yellow of the sky—a couple of hundred people,
perhaps. there were raised voices, and some sort of struggle appeared
to be going on about the pit. strange imaginings passed through my
mind. as i drew nearer i heard stent’s voice:","Quand je suis revenu au bord de la mer, le soleil se couchait.
de l'homme, de la femme, de l'homme, de l'homme, de l'homme, de l'homme, de l'homme, de l'homme, de l'homme
La foule autour de la fosse s'était accrue et se détachait en noir sur le jaune citron du ciel.
sur le jaune citron du ciel - quelques centaines de personnes,
des voix s'élevaient, et une sorte de lutte semblait se dérouler autour de la fosse.
de la fosse. d'étranges imaginations me traversaient l'esprit.
En m'approchant, j'entendis la voix de Stent :","quand je suis revenu à la commune, le soleil se couchait. groupes dispersés
se précipitaient dans la direction du réveil, et une ou deux personnes étaient
revenir. la foule autour de la fosse avait augmenté et se détachait en noir
sur le jaune citron du ciel – quelques centaines de personnes,
peut-être. des voix s'élevèrent et une sorte de lutte apparut
parler de la fosse. d'étranges imaginations m'ont traversé
esprit. en m'approchant, j'ai entendu la voix du stent :","quand je revins à la lande, le soleil se couchait. des groupes épars se
hâtaient, venant de woking, et une ou deux personnes s’en retournaient.
la foule autour du trou avait augmenté, et se détachait noire sur le
jaune pâle du ciel deux cents personnes environ. des voix s’élevèrent
et il sembla se produire une sorte de lutte à l’entour du trou.
d’étranges idées me vinrent à l’esprit. comme j’approchais, j’entendis
la voix de stent qui criait:"
keep back! keep back!,Ne vous arrêtez pas ! Ne vous arrêtez pas !,retiens-toi ! retiens-toi !,en arrière! en arrière!
a boy came running towards me.,un garçon a couru vers moi.,un garçon est venu en courant vers moi.,un gamin arrivait en courant vers moi:
"it’s a-movin’, he said to me as he passed; a-screwin’ and a-screwin’
out. i don’t like it. i’m a-goin’ ’ome, i am.","ça bouge, m'a-t-il dit en passant, ça tourne, ça tourne... Je n'aime pas ça.
Je n'aime pas ça. Je vais rentrer chez moi.","ça bouge, me dit-il en passant ; une baise et une baise
dehors. je n'aime pas ça. je pars chez moi, je le suis.","ça remue, me dit-il en passant ça se dévisse tout seul. c’est du
louche, tout ça merci je me sauve."
"i went on to the crowd. there were really, i should think, two or three
hundred people elbowing and jostling one another, the one or two ladies
there being by no means the least active.","Je suis allé vers la foule. Il y avait vraiment, je pense, deux ou trois cents personnes qui se bousculaient et jouaient des coudes, une ou deux dames.
de deux ou trois cents personnes qui jouaient des coudes et se bousculaient, les une ou deux dames
les deux dames qui se trouvaient là n'étaient pas les moins actives.","je suis allé vers la foule. il y en avait vraiment, je pense, deux ou trois
des centaines de personnes se coudaient et se bousculaient, une ou deux dames
il n’y en a pas du tout le moins actif.","je continuai ma route. il y avait bien là, j’imagine, deux ou trois
cents personnes se pressant et se coudoyant, les quelques femmes n’étant
en aucune façon les moins actives."
he’s fallen in the pit! cried some one.,il est tombé dans la fosse ! s'écria quelqu'un.,il est tombé dans la fosse ! s'écria quelqu'un.,il est tombé dans le trou! cria quelqu’un.
keep back! said several.,Revenez ! ont dit plusieurs.,retiens-toi ! dirent plusieurs.,en arrière! crièrent des voix.
"the crowd swayed a little, and i elbowed my way through. every one
seemed greatly excited. i heard a peculiar humming sound from the pit.","la foule s'est un peu agitée, et j'ai joué des coudes pour me frayer un chemin. tout le monde semblait très excité.
J'ai entendu un bourdonnement particulier provenant de la fosse.","la foule a légèrement oscillé et je me suis frayé un chemin à coups de coude. tout le monde
semblait très excité. J'ai entendu un bourdonnement particulier venant de la fosse.","la foule s’agita quelque peu, et en jouant des coudes, je me frayai un
chemin entre les rangs pressés. tout ce monde semblait grandement
surexcité. j’entendis un bourdonnement particulier qui venait du trou."
"i say! said ogilvy; help keep these idiots back. we don’t know
what’s in the confounded thing, you know!","Je le dis ! dit Ogilvy ; aidez-nous à retenir ces idiots.
ce qu'il y a dans ce foutu truc, vous savez !","je dis! dit Ogilvy ; aidez à retenir ces idiots. nous ne savons pas
qu’est-ce qu’il y a dans cette foutue chose, tu sais !","dites donc, me cria ogilvy, aidez-nous à maintenir ces idiots à
distance. on ne sait pas ce qu’il peut y avoir dans cette diable de
chose."
"i saw a young man, a shop assistant in woking i believe he was,
standing on the cylinder and trying to scramble out of the hole again.
the crowd had pushed him in.","J'ai vu un jeune homme, vendeur à Woking je crois,
debout sur le cylindre et essayant de sortir du trou.
La foule l'avait poussé à l'intérieur.","J'ai vu un jeune homme, un vendeur à Woking, je crois que c'était lui,
debout sur le cylindre et essayant à nouveau de sortir du trou.
la foule l'avait poussé à l'intérieur.","je vis un jeune homme, que je reconnus pour un garçon de boutique de
woking, qui essayait de regrimper hors du trou dans lequel la foule
l’avait poussé."
"the end of the cylinder was being screwed out from within. nearly two
feet of shining screw projected. somebody blundered against me, and i
narrowly missed being pitched onto the top of the screw. i turned, and
as i did so the screw must have come out, for the lid of the cylinder
fell upon the gravel with a ringing concussion. i stuck my elbow into
the person behind me, and turned my head towards the thing again. for a
moment that circular cavity seemed perfectly black. i had the sunset in
my eyes.","l'extrémité du cylindre était vissée de l'intérieur. près de deux pieds de vis brillante étaient projetés.
de la vis brillante. quelqu'un a fait une bévue contre moi, et j'ai manqué de peu d'être projeté sur le haut de la vis.
et j'ai manqué de peu d'être projeté sur le sommet de la vis.
Je me suis retourné et, ce faisant, la vis a dû se détacher, car le couvercle du cylindre est tombé sur le gravier avec un bruit sourd.
le couvercle du cylindre tomba sur le gravier avec une commotion retentissante.
coude dans la personne derrière moi, et je tournai à nouveau la tête vers la chose.
Pendant un instant, cette cavité circulaire m'a semblé parfaitement noire.
J'avais le coucher de soleil dans les yeux.","l'extrémité du cylindre était dévissée de l'intérieur. près de deux
pieds de vis brillants projetés. quelqu'un a fait une gaffe contre moi, et je
a raté de peu d'être lancé sur le dessus de la vis. je me suis retourné et
ce faisant, la vis a dû sortir, pour le couvercle du cylindre
tomba sur le gravier avec une commotion retentissante. j'ai mis mon coude dedans
la personne derrière moi, et j'ai de nouveau tourné la tête vers la chose. pour un
à ce moment-là, cette cavité circulaire semblait parfaitement noire. j'ai eu le coucher de soleil
mes yeux.","le sommet du cylindre continuait à se dévisser de l’intérieur. déjà
cinquante centimètres de vis brillante paraissaient; quelqu’un vint
trébucher contre moi et je faillis bien être précipité contre le
cylindre. je me retournai, et à ce moment le dévissage dut être au bout,
car le couvercle tomba sur les graviers avec un choc retentissant.
j’opposai solidement mon coude à la personne qui se trouvait derrière
moi et tournai mes regards vers la chose. pendant un moment cette cavité
circulaire sembla parfaitement noire. j’avais le soleil dans les yeux."
"i think everyone expected to see a man emerge—possibly something a
little unlike us terrestrial men, but in all essentials a man. i know i
did. but, looking, i presently saw something stirring within the
shadow: greyish billowy movements, one above another, and then two
luminous disks—like eyes. then something resembling a little grey
snake, about the thickness of a walking stick, coiled up out of the
writhing middle, and wriggled in the air towards me—and then another.","Je pense que tout le monde s'attendait à voir émerger un homme - peut-être quelque chose d'un peu différent de nous, les hommes terrestres, mais essentiellement un homme.
peut-être un peu différent de nous, les hommes terrestres, mais essentiellement un homme.
Mais en regardant, j'ai tout de suite vu quelque chose s'agiter dans l'ombre : des mouvements grisâtres, l'un au-dessus de l'autre, puis deux
l'ombre : des mouvements grisâtres et vaporeux, l'un au-dessus de l'autre, puis deux
puis deux yeux lumineux en forme de disques. puis quelque chose qui ressemblait à un petit serpent gris
de l'épaisseur d'une canne, s'enroulait au milieu de ce tortillard et
s'enroulait au milieu de l'ombre et se tortillait dans l'air dans ma direction, puis un autre.","je pense que tout le monde s'attendait à voir un homme émerger, peut-être quelque chose d'anormal.
un peu différent de nous, les hommes terrestres, mais essentiellement un homme. je sais que je
a fait. mais, en regardant, j'ai vu quelque chose remuer à l'intérieur du
ombre : mouvements ondulés grisâtres, l'un au-dessus de l'autre, puis deux
disques lumineux, comme des yeux. puis quelque chose qui ressemble à un peu de gris
serpent, de l'épaisseur d'une canne, enroulé hors du
se tordant au milieu, et se tortilla dans les airs vers moi – et puis un autre.","je crois que tout le monde s’attendait à voir surgir un
homme possiblement quelque être un peu différent des hommes terrestres,
mais, en ces parties essentielles, un homme. je sais que c’était mon
cas. mais, regardant attentivement, je vis bientôt quelque chose remuer
dans l’ombre des mouvements incertains et houleux, l’un par-dessus
l’autre puis deux disques lumineux comme des yeux. enfin, une chose qui
ressemblait à un petit serpent gris, de la grosseur environ d’une canne
ordinaire, se déroula hors d’une masse repliée et se tortilla dans l’air
de mon côté puis ce fut le tour d’une autre."
"a sudden chill came over me. there was a loud shriek from a woman
behind. i half turned, keeping my eyes fixed upon the cylinder still,
from which other tentacles were now projecting, and began pushing my
way back from the edge of the pit. i saw astonishment giving place to
horror on the faces of the people about me. i heard inarticulate
exclamations on all sides. there was a general movement backwards. i
saw the shopman struggling still on the edge of the pit. i found myself
alone, and saw the people on the other side of the pit running off,
stent among them. i looked again at the cylinder, and ungovernable
terror gripped me. i stood petrified and staring.","J'ai eu un frisson soudain. une femme a poussé un grand cri derrière moi.
Je me retournai à demi, gardant les yeux fixés sur le cylindre d'où sortaient maintenant d'autres tentacules,
d'où sortaient d'autres tentacules, et j'ai commencé à m'éloigner du bord de la fosse.
Je vis l'étonnement faire place à l'horreur sur les visages des gens qui
l'horreur sur les visages des gens qui m'entouraient.
exclamations inarticulées de tous côtés. il y avait un mouvement général vers l'arrière.
Je vis le commerçant se débattre encore sur le bord de la fosse.
seul, et je vis les gens de l'autre côté de la fosse s'enfuir,
Je regardai à nouveau le cylindre et une terreur incontrôlable s'empara de moi.
Je suis resté pétrifié et j'ai regardé fixement.","un frisson soudain m'envahit. il y a eu un grand cri venant d'une femme
derrière. Je me tournai à moitié, gardant les yeux toujours fixés sur le cylindre,
d'où sortaient maintenant d'autres tentacules, et j'ai commencé à pousser mon
très loin du bord de la fosse. j'ai vu l'étonnement faire place à
l'horreur sur les visages des gens autour de moi. j'ai entendu des mots inarticulés
des exclamations de toutes parts. il y a eu un mouvement général de recul. je
J'ai vu le commerçant se débattre encore au bord de la fosse. je me suis retrouvé
seul, et j'ai vu les gens de l'autre côté de la fosse s'enfuir,
stent parmi eux. j'ai encore regardé le cylindre, et c'est ingouvernable
la terreur m'a saisi. je restais pétrifié et je regardais.","un frisson soudain me passa par tout le corps. une femme derrière moi
poussa un cri aigu. je me tournai à moitié, sans quitter des yeux le
cylindre hors duquel d’autres tentacules surgissaient maintenant, et je
commençai à coups de coudes à me frayer un chemin en arrière du bord. je
vis l’étonnement faire place à l’horreur sur les faces des gens qui
m’entouraient. j’entendis de tous côtés des exclamations confuses et il
y eut un mouvement général de recul. le jeune boutiquier se hissait à
grands efforts sur le bord du trou, et tout à coup je me trouvai seul,
tandis que de l’autre côté les gens s’enfuyaient, et stent parmi eux. je
reportai les yeux vers le cylindre et une irrésistible terreur s’empara
de moi. je demeurai ainsi pétrifié et les yeux fixes."
"a big greyish rounded bulk, the size, perhaps, of a bear, was rising
slowly and painfully out of the cylinder. as it bulged up and caught
the light, it glistened like wet leather.","une grosse masse arrondie et grisâtre, de la taille d'un ours peut-être, s'élevait lentement et péniblement hors du cylindre.
lentement et péniblement hors du cylindre. en se gonflant et en captant la lumière, elle
la lumière, elle brillait comme du cuir mouillé.","une grosse masse arrondie grisâtre, de la taille peut-être d'un ours, augmentait
lentement et douloureusement hors du cylindre. alors qu'il s'est gonflé et s'est accroché
à la lumière, il brillait comme du cuir mouillé.","une grosse masse grisâtre et ronde, de la grosseur à peu près d’un ours,
s’élevait lentement et péniblement hors du cylindre. au moment où elle
parut en pleine lumière, elle eut des reflets de cuir mouillé. deux
grands yeux sombres me regardaient fixement. l’ensemble de la masse
était rond et possédait pour ainsi dire une face: il y avait sous les
yeux une bouche, dont les bords sans lèvres tremblotaient, s’agitaient
et laissaient échapper une sorte de salive. le corps palpitait et
haletait convulsivement. un appendice tentaculaire long et mou agrippa
le bord du cylindre et un autre se balança dans l’air."
"two large dark-coloured eyes were regarding me steadfastly. the mass
that framed them, the head of the thing, was rounded, and had, one
might say, a face. there was a mouth under the eyes, the lipless brim
of which quivered and panted, and dropped saliva. the whole creature
heaved and pulsated convulsively. a lank tentacular appendage gripped
the edge of the cylinder, another swayed in the air.","deux grands yeux sombres me regardaient fixement. la masse qui les encadrait, la tête de la
la masse qui les encadrait, la tête de la chose, était arrondie et avait, pourrait-on dire, un visage.
une bouche sous les yeux, dont le bord sans lèvres frémissait, haletait et laissait échapper de la salive.
de la bouche sous les yeux, dont le bord sans lèvres frémissait, haletait et laissait échapper de la salive. la créature entière
La créature tout entière se soulevait et palpitait convulsivement.
le bord du cylindre, un autre se balançait en l'air.","deux grands yeux sombres me regardaient fixement. la masse
qui les encadrait, la tête de la chose était arrondie et avait un
pourrait-on dire, un visage. il y avait une bouche sous les yeux, le bord sans lèvres
dont frémit et haletait, et laissa tomber de la salive. la créature entière
il était soulevé et palpitait convulsivement. un appendice tentaculaire élancé saisi
Au bord du cylindre, un autre se balançait dans les airs.","ceux qui n’ont jamais vu un marsien vivant peuvent difficilement
s’imaginer l’horreur étrange de leur aspect, leur bouche singulière en
forme de v et la lèvre supérieure pointue, le manque de front, l’absence
de menton au-dessous de la lèvre inférieure en coin, le remuement
incessant de cette bouche, le groupe gorgonesque des tentacules, la
respiration tumultueuse des poumons dans une atmosphère différente,
leurs mouvements lourds et pénibles, à cause de l’énergie plus grande de
la pesanteur sur la terre et par-dessus tout l’extraordinaire intensité
de leurs yeux énormes tout cela me produisit un effet qui tenait de la
nausée. il y avait quelque chose de fougueux dans la peau brune
huileuse, quelque chose d’inexprimablement terrible dans la maladroite
assurance de leurs lents mouvements. même à cette première rencontre, je
fus saisi de dégoût et d’épouvante."
"those who have never seen a living martian can scarcely imagine the
strange horror of its appearance. the peculiar v-shaped mouth with its
pointed upper lip, the absence of brow ridges, the absence of a chin
beneath the wedgelike lower lip, the incessant quivering of this mouth,
the gorgon groups of tentacles, the tumultuous breathing of the lungs
in a strange atmosphere, the evident heaviness and painfulness of
movement due to the greater gravitational energy of the earth—above
all, the extraordinary intensity of the immense eyes—were at once
vital, intense, inhuman, crippled and monstrous. there was something
fungoid in the oily brown skin, something in the clumsy deliberation of
the tedious movements unspeakably nasty. even at this first encounter,
this first glimpse, i was overcome with disgust and dread.","ceux qui n'ont jamais vu un martien vivant peuvent difficilement imaginer l'étrange horreur de son apparence.
l'étrange horreur de son apparence. la bouche en forme de V avec sa lèvre supérieure pointue
lèvre supérieure pointue, l'absence d'arcades sourcilières, l'absence de menton sous la
sous la lèvre inférieure cunéiforme, le frémissement incessant de cette bouche,
les groupes de tentacules de la gorgone, la respiration tumultueuse des poumons
dans une atmosphère étrange, la lourdeur évidente et la pénibilité des
mouvement dues à la plus grande énergie gravitationnelle de la terre, et surtout l'extraordinaire
l'intensité extraordinaire des yeux immenses - étaient à la fois vitaux, intenses
vital, intense, inhumain, infirme et monstrueux. il y avait quelque chose de
fongoïde dans la peau brune et grasse, quelque chose d'indescriptible dans les
de la délibération maladroite des mouvements fastidieux. même lors de cette première rencontre,
ce premier regard, j'ai été envahi par le dégoût et l'effroi.","ceux qui n'ont jamais vu un Martien vivant peuvent à peine imaginer le
étrange horreur de son apparition. la bouche particulière en forme de V avec son
lèvre supérieure pointue, absence d'arcades sourcilières, absence de menton
sous la lèvre inférieure en coin, le frémissement incessant de cette bouche,
les groupes de tentacules des gorgones, la respiration tumultueuse des poumons
dans une atmosphère étrange, la lourdeur et la douleur évidentes de
mouvement dû à la plus grande énergie gravitationnelle de la terre - au-dessus
tout, l'extraordinaire intensité des yeux immenses, furent à la fois
vital, intense, inhumain, estropié et monstrueux. il y avait quelque chose
fongoïde dans la peau brune et grasse, quelque chose dans la délibération maladroite de
les mouvements fastidieux sont indiciblement méchants. même à cette première rencontre,
Dès ce premier aperçu, j'ai été submergé de dégoût et d'effroi.","soudain le monstre disparut. il avait chancelé sur le bord du cylindre
et dégringolé dans le trou avec un bruit semblable à celui que
produirait une grosse masse de cuir. je l’entendis pousser un singulier
cri rauque et immédiatement après une autre de ces créatures apparut
vaguement dans l’ombre épaisse de l’ouverture."
"suddenly the monster vanished. it had toppled over the brim of the
cylinder and fallen into the pit, with a thud like the fall of a great
mass of leather. i heard it give a peculiar thick cry, and forthwith
another of these creatures appeared darkly in the deep shadow of the
aperture.","soudain le monstre disparut. il avait basculé par-dessus le bord du cylindre et était tombé dans la fosse, avec un bruit sourd comme la chute d'un grand homme.
cylindre et tomba dans la fosse, avec un bruit sourd comme la chute d'une grande
Je l'entendis pousser un cri épais et particulier, et aussitôt une autre de ces
une autre de ces créatures apparut dans l'ombre profonde de l'ouverture.
l'ouverture.","tout à coup, le monstre disparut. il était tombé par-dessus le bord du
cylindre et tomba dans la fosse, avec un bruit sourd semblable à la chute d'un grand
masse de cuir. je l'ai entendu pousser un cri étrange et épais, et aussitôt
une autre de ces créatures apparut sombrement dans l'ombre profonde du
ouverture.","alors mon accès de terreur cessa. je me détournai et dans une course
folle m’élançai vers le premier groupe d’arbres, à environ cent mètres
de là. mais je courais obliquement et en trébuchant, car je ne pouvais
détourner mes regards de ces choses."
"i turned and, running madly, made for the first group of trees, perhaps
a hundred yards away; but i ran slantingly and stumbling, for i could
not avert my face from these things.","Je me retournai et, courant comme un fou, je me dirigeai vers le premier groupe d'arbres, à une centaine de mètres peut-être.
cent mètres ; mais je courais en biais et en trébuchant, car je ne pouvais pas
ne pouvais détourner mon visage de ces choses.","je me suis retourné et, courant comme un fou, je me suis dirigé vers le premier groupe d'arbres, peut-être
à une centaine de mètres ; mais j'ai couru de biais et en trébuchant, car je pouvais
je ne détournerai pas mon visage de ces choses.","parmi quelques jeunes sapins et des buissons de genêts, je m’arrêtai
haletant, anxieux de ce qui allait se produire. la lande, autour du
trou, était couverte de gens épars, comme moi à demi fascinés de
terreur, épiant ces créatures, ou plutôt l’amas de gravier bordant le
trou dans lequel elles étaient. alors, avec une horreur nouvelle, je vis
un objet rond et noir s’agiter au bord du talus. c’était la tête du
boutiquier qui était tombé dans la fosse, et cette tête semblait un
petit point noir contre les flammes du ciel occidental. il parvint à
sortir une épaule et un genou, mais il parut retomber de nouveau et sa
tête seule resta visible. soudain il disparut et je m’imaginai qu’un
faible cri venait jusqu’à moi. une impulsion irraisonnée m’ordonna
d’aller à son aide, sans que je pusse surmonter mes craintes."
