original english paragraphs,deepl paragraphs,google paragraphs,human-translated paragraphs
"what’s that? cried a boatman, and shut up, you fool! said a man
near me to a yelping dog. then the sound came again, this time from the
direction of chertsey, a muffled thud—the sound of a gun.","Qu'est-ce que c'est ? s'écria un batelier, et tais-toi, imbécile ! dit un homme près de moi à un chien qui jappait.
près de moi à un chien qui jappait. puis le bruit revint, cette fois de la direction de
direction de Chertsey, un bruit sourd, le bruit d'un fusil.","Qu'est ce que c'est? cria un batelier, et tais-toi, imbécile ! dit un homme
près de moi à un chien qui jappe. puis le son revint, cette fois du
direction de chertsey, un bruit sourd – le bruit d’un pistolet.","qu’est-ce que c’est que tout cela? s’exclamait un batelier. puis, plus près de moi:
tais-toi donc, sale bête! criait un homme à un chien qui hurlait.
a ce moment, on entendit de nouveau, mais cette fois dans la direction
de chertsey, un son assourdi la détonation d’un canon."
"the fighting was beginning. almost immediately unseen batteries across
the river to our right, unseen because of the trees, took up the
chorus, firing heavily one after the other. a woman screamed. everyone
stood arrested by the sudden stir of battle, near us and yet invisible
to us. nothing was to be seen save flat meadows, cows feeding
unconcernedly for the most part, and silvery pollard willows motionless
in the warm sunlight.","les combats commençaient. presque immédiatement, des batteries invisibles de l'autre côté de la rivière à notre droite, invisibles à cause des arbres, ont pris le dessus.
de l'autre côté de la rivière, à notre droite, invisibles à cause des arbres, ont repris le refrain, tirant lourdement l'une après l'autre. une femme a crié.
les unes après les autres. une femme a crié. tout le monde s'est arrêté devant l'agitation soudaine de la bataille, proche de nous et pourtant invisible.
tout le monde était arrêté par l'agitation soudaine de la bataille, proche de nous et pourtant invisible pour nous.
On ne voyait rien d'autre que des prés plats, des vaches qui paissaient, insouciantes pour la plupart.
vaches mangeant sans souci pour la plupart, et des saules têtards argentés immobiles
dans la lumière chaude du soleil.","les combats commençaient. des batteries presque immédiatement invisibles à travers
la rivière à notre droite, invisible à cause des arbres, occupait le
chœur, tirant lourdement les uns après les autres. Cria une femme. tout le monde
se tenait arrêté par le brusque mouvement de la bataille, près de nous et pourtant invisible
pour nous. on ne voyait rien d'autre que des prairies plates, des vaches en train de se nourrir
indifférents pour la plupart, et les saules têtards argentés immobiles
sous la chaude lumière du soleil.","la lutte commençait. presque immédiatement, d’invisibles batteries,
cachées par des bouquets d’arbres sur l’autre rive du fleuve, à notre
droite, firent chorus, crachant leurs obus régulièrement l’une après
l’autre. une femme s’évanouit. tout le monde sursauta, avec, en suspens,
le soudain émoi de la bataille si proche et que nous ne pouvions voir
encore. le regard ne parcourait que des prairies unies, où des bœufs
paissaient avec indifférence entre des saules argentés au feuillage
immobile sous le chaud soleil."
"the sojers’ll stop ’em, said a woman beside me, doubtfully. a
haziness rose over the treetops.","les sojers les arrêteront, dit une femme à côté de moi, dubitative.
brume s'élevait au-dessus de la cime des arbres.","les sojers vont les arrêter, dit une femme à côté de moi, dubitative. un
le brouillard montait au-dessus de la cime des arbres.","les soldats les arrêteront bien, dit une femme, d’un ton peu rassuré.
une brume monta au-dessus des arbres."
"then suddenly we saw a rush of smoke far away up the river, a puff of
smoke that jerked up into the air and hung; and forthwith the ground
heaved under foot and a heavy explosion shook the air, smashing two or
three windows in the houses near, and leaving us astonished.","Nous avons soudain vu un jet de fumée au loin, en amont de la rivière, une bouffée de fumée qui s'est élevée en l'air et qui est restée suspendue.
de fumée qui s'élevait en l'air et restait suspendue.
et une lourde explosion a secoue l'air, brisant deux ou trois fenetres dans les
deux ou trois fenêtres des maisons voisines, et nous laissa stupéfaits.","puis tout à coup nous avons aperçu un flot de fumée au loin en amont de la rivière, un souffle de
de la fumée qui s'élevait dans l'air et restait suspendue ; et aussitôt le sol
soulevé sous les pieds et une forte explosion secoua l'air, brisant deux ou
trois fenêtres dans les maisons voisines, et nous laissent étonnés.","puis soudain nous vîmes un énorme
flot de fumée qui envahit rapidement le ciel; au même moment, le sol
trembla sous nos pieds et une explosion immense secoua l’atmosphère,
brisant les vitres des maisons proches et nous plongeant dans la
stupéfaction."
"here they are! shouted a man in a blue jersey. yonder! d’yer see
them? yonder!","les voilà ! cria un homme en maillot bleu. là-bas ! les voyez-vous ?
les voir ? là-bas !","les voilà ! » a crié un homme en maillot bleu. là-bas ! tu vois
eux? là-bas !","les voilà! cria un homme vêtu d’un jersey bleu. là-bas! les
voyez-vous? là-bas!"
"quickly, one after the other, one, two, three, four of the armoured
martians appeared, far away over the little trees, across the flat
meadows that stretched towards chertsey, and striding hurriedly towards
the river. little cowled figures they seemed at first, going with a
rolling motion and as fast as flying birds.","rapidement, l'un après l'autre, un, deux, trois, quatre des martiens en
martiens cuirassés apparurent, au loin, par-dessus les petits arbres, à travers les
prairies plates qui s'étendaient vers chertsey, et se dirigeant à grands pas vers la rivière.
de la rivière. ils semblaient d'abord de petites silhouettes encapuchonnées, allant d'un mouvement
de la rivière. Ils semblaient d'abord de petites silhouettes vachées, allant d'un mouvement de roulis et aussi vite que des oiseaux volants.","rapidement, l'un après l'autre, un, deux, trois, quatre des blindés
des martiens apparurent, au loin, au-dessus des petits arbres, à travers le plat
prairies qui s'étendaient vers Chertsey, et s'avançant à grands pas vers
la rivière. ils semblaient au début de petites silhouettes encapuchonnées, allant avec un
mouvement de roulement et aussi rapide que les oiseaux en vol.","rapidement, l’un après l’autre, parurent deux, trois, puis quatre
marsiens, bien loin par delà les arbres bas, à travers les prés
s’étendant jusqu’à chertsey et ils se dirigeaient avec d’énormes
enjambées vers la rivière. ils parurent être, d’abord, de petites formes
encapuchonnées, s’avançant à une allure aussi rapide que le vol des
oiseaux."
"then, advancing obliquely towards us, came a fifth. their armoured
bodies glittered in the sun as they swept swiftly forward upon the
guns, growing rapidly larger as they drew nearer. one on the extreme
left, the remotest that is, flourished a huge case high in the air, and
the ghostly, terrible heat-ray i had already seen on friday night smote
towards chertsey, and struck the town.","puis, s'avançant obliquement vers nous, un cinquième.
de leurs corps blindés scintillaient au soleil tandis qu'ils s'avançaient rapidement sur les
canon, grossissant rapidement à mesure qu'ils s'en approchaient.
gauche, c'est-à-dire le plus éloigné, brandissait en l'air une énorme caisse, et
le terrible et fantomatique rayon de chaleur que j'avais déjà vu le vendredi soir se dirigea
vers Chertsey et frappa la ville.","puis, s'avançant obliquement vers nous, vint un cinquième. leurs blindés
les corps brillaient au soleil alors qu'ils avançaient rapidement sur le
des canons, devenant rapidement plus gros à mesure qu'ils se rapprochaient. un à l'extrême
à gauche, la plus éloignée qui soit, s'épanouissait dans les airs avec une énorme caisse, et
le terrible rayon de chaleur fantomatique que j'avais déjà vu vendredi soir a frappé
vers Chertsey et frappa la ville.","puis, arrivant obliquement dans notre direction, un cinquième monstre
parut. leur masse cuirassée scintillait au soleil, tandis qu’ils
accouraient vers les pièces d’artillerie et ils paraissaient de plus en
plus grands à mesure qu’ils approchaient. l’un d’eux, le plus éloigné
vers la gauche, brandissait aussi haut qu’il pouvait une sorte d’immense
étui, et ce terrible et sinistre rayon ardent, que j’avais vu à l’œuvre
le vendredi soir, jaillit soudain dans la direction de chertsey et
attaqua la ville."
"at sight of these strange, swift, and terrible creatures the crowd near
the water’s edge seemed to me to be for a moment horror-struck. there
was no screaming or shouting, but a silence. then a hoarse murmur and a
movement of feet—a splashing from the water. a man, too frightened to
drop the portmanteau he carried on his shoulder, swung round and sent
me staggering with a blow from the corner of his burden. a woman thrust
at me with her hand and rushed past me. i turned with the rush of the
people, but i was not too terrified for thought. the terrible heat-ray
was in my mind. to get under water! that was it!","A la vue de ces étranges, rapides et terribles créatures, la foule, près du
de l'eau me parut un instant frappée d'horreur. il n'y eut ni cris ni hurlements, mais un silence.
de l'eau. il n'y eut ni cris ni hurlements, mais un silence. puis un murmure rauque et un
un mouvement de pieds, un clapotis dans l'eau. un homme, trop effrayé pour laisser tomber le porte-manteau qu'il portait, s'approcha de l'eau.
un homme, trop effrayé pour laisser tomber le porte-manteau qu'il portait sur l'épaule, se retourna et m'envoya chanceler d'un coup de poing sur la tête.
m'a fait chanceler d'un coup du coin de son fardeau. une femme m'a poussé de la main et s'est
me poussa de la main et me dépassa. je me retournai dans la cohue, mais je n'étais pas trop terrifié.
Je me retournai dans la cohue, mais je n'étais pas trop terrifié pour réfléchir.
de l'eau ! c'était cela !","à la vue de ces créatures étranges, rapides et terribles, la foule se rapprochait
le bord de l’eau me parut un instant frappé d’horreur. là
Il n'y avait pas de cris ni de cris, mais un silence. puis un murmure rauque et un
mouvement des pieds – une éclaboussure de l’eau. un homme, trop effrayé pour
lâcha le portemanteau qu'il portait sur son épaule, se retourna et envoya
moi chancelant d'un coup du coin de son fardeau. une femme poussée
vers moi avec sa main et s'est précipitée devant moi. je me suis retourné avec la précipitation du
les gens, mais je n'étais pas trop terrifié pour réfléchir. le terrible rayon de chaleur
était dans mon esprit. se mettre sous l'eau ! c'était ça !","a la vue de ces étranges, rapides et terribles créatures, la foule qui
se pressait sur les rives sembla un instant frappée d’horreur. il n’y
eut pas un mot, pas un cri mais le silence. puis un rauque murmure,
une poussée et l’éclaboussement de l’eau. un homme, trop effrayé pour
poser la malle qu’il portait sur l’épaule, se retourna et me fit
chanceler en me heurtant avec le coin de son fardeau. une femme me
repoussa violemment et se mit à courir. je me retournai aussi, dans
l’élan de la foule, mais la terreur ne m’empêcha pas de réfléchir. je
pensais au terrible rayon ardent. se jeter dans l’eau, voilà ce qu’il
fallait faire."
"get under water! i shouted, unheeded.","Je criais, sans être écoutée.","passez sous l'eau ! ai-je crié, sans être entendu.",tout le monde à l’eau! criai-je sans être entendu.
"i faced about again, and rushed towards the approaching martian, rushed
right down the gravelly beach and headlong into the water. others did
the same. a boatload of people putting back came leaping out as i
rushed past. the stones under my feet were muddy and slippery, and the
river was so low that i ran perhaps twenty feet scarcely waist-deep.
then, as the martian towered overhead scarcely a couple of hundred
yards away, i flung myself forward under the surface. the splashes of
the people in the boats leaping into the river sounded like
thunderclaps in my ears. people were landing hastily on both sides of
the river. but the martian machine took no more notice for the moment
of the people running this way and that than a man would of the
confusion of ants in a nest against which his foot has kicked. when,
half suffocated, i raised my head above water, the martian’s hood
pointed at the batteries that were still firing across the river, and
as it advanced it swung loose what must have been the generator of the
heat-ray.","J'ai de nouveau fait face et je me suis précipité vers le martien qui s'approchait, j'ai dévalé la plage de gravier et je me suis jeté dans l'eau.
de l'eau. d'autres ont fait de même. une foule de gens qui reculaient sont sortis de l'eau en bondissant.
un bateau plein de gens qui s'étaient repliés sont sortis d'un bond lorsque je suis passé devant eux.
Les pierres sous mes pieds étaient boueuses et glissantes, et la rivière était si basse que j'ai couru peut-être jusqu'au bout.
la rivière était si basse que je courais peut-être sur vingt pieds, à peine jusqu'à la taille.
puis, alors que le martien se dressait au-dessus de moi à quelques centaines de mètres à peine, je me suis jeté dans le vide.
centaines de mètres, je me suis jeté en avant sous la surface de l'eau.
les gens dans les bateaux qui sautaient dans la rivière résonnaient comme des coups de tonnerre à mes oreilles.
Les gens débarquaient en hâte des deux côtés de la rivière.
Mais la machine martienne ne fit plus attention, pour le moment, aux gens qui couraient de-ci de-là.
de ces gens qui couraient dans tous les sens, pas plus qu'un homme n'aurait
confusion des fourmis dans un nid contre lequel son pied a donné un coup de pied,
étouffé, je levai la tête hors de l'eau, le capuchon du martien
le capuchon du martien pointait vers les batteries qui tiraient encore de l'autre côté de la rivière, et
et, en avançant, il détachait ce qui devait être le générateur des
rayons de chaleur.","je me suis retourné de nouveau et je me suis précipité vers le martien qui approchait, je me suis précipité
directement sur la plage de gravier et tête baissée dans l'eau. d'autres l'ont fait
le même. un bateau rempli de gens en train de reculer est sorti en bondissant alors que je
passé précipitamment. les pierres sous mes pieds étaient boueuses et glissantes, et le
la rivière était si basse que j'ai couru environ vingt pieds jusqu'à la taille.
puis, alors que le martien dominait à peine quelques centaines de
à quelques mètres de là, je me suis jeté en avant sous la surface. les éclaboussures de
les gens dans les bateaux sautant dans la rivière ressemblaient à
des coups de tonnerre dans mes oreilles. les gens débarquaient en toute hâte des deux côtés de
la rivière. mais la machine martienne n'y prêta plus attention pour le moment
des gens qui courent dans cette direction et dans celle-là qu'un homme ne le ferait de la
confusion de fourmis dans un nid contre lequel son pied a donné un coup de pied. quand,
A moitié étouffé, j'ai levé la tête hors de l'eau, la capuche de martien
pointa du doigt les batteries qui tiraient encore de l'autre côté de la rivière, et
à mesure qu'il avançait, il a libéré ce qui devait être le générateur du
rayon de chaleur.","je fis de nouveau face à la rivière et, me précitant, dans la direction
du marsien qui approchait, jusqu’à la rive de sable, j’entrai dans
l’eau. d’autres firent de même. une barque pleine de gens, revenant vers
le bord, chavira presque, au moment où je passais. les pierres sous mes
pieds étaient boueuses et glissantes et le niveau des eaux était si bas
que j’avançai pendant plus de cinq mètres avant d’avoir de l’eau jusqu’à
la ceinture. l’éclaboussement des gens des bateaux sautant dans l’eau
résonnait à mes oreilles comme un tonnerre. on abordait en toute hâte
sur les deux rives. mais pour le moment, les marsiens ne faisaient pas plus attention aux
gens courant de tous côtés qu’un homme, qui aurait heurté du pied une
fourmilière, ne ferait attention à la débandade des fourmis. quand, à
demi suffoqué, je me soulevai hors de l’eau, la tête du marsien semblait
considérer attentivement les batteries qui tiraient encore par-dessus la
rivière, et, tout en avançant, il abaissa et éteignit ce qui devait être
le générateur du rayon ardent."
"in another moment it was on the bank, and in a stride wading halfway
across. the knees of its foremost legs bent at the farther bank, and in
another moment it had raised itself to its full height again, close to
the village of shepperton. forthwith the six guns which, unknown to
anyone on the right bank, had been hidden behind the outskirts of that
village, fired simultaneously. the sudden near concussion, the last
close upon the first, made my heart jump. the monster was already
raising the case generating the heat-ray as the first shell burst six
yards above the hood.","Le plus souvent, il s'agit d'une personne qui n'a jamais été en contact avec le public.
Les genoux de ses pattes les plus avancées se pliaient à l'autre rive, et en un
de l'autre rive, et, dans un autre moment, il s'est de nouveau levé de toute sa hauteur, près du village de Shepperton.
le village de Shepperton. aussitôt les six canons qui, à l'insu de tous les
de la rive droite, avaient été cachés derrière les faubourgs du village, tirèrent simultanément.
de ce village, tirèrent simultanément. la quasi-concussion soudaine, le dernier
dernier près du premier, me fit bondir le cœur. le monstre soulevait déjà la caisse
le monstre soulevait déjà l'étui générant le rayon de chaleur lorsque le premier obus éclata à six
mètres au-dessus du capot.","un instant plus tard, il était sur la berge et, d'un pas, pataugeait à mi-chemin
à travers. les genoux de ses pattes avant fléchis sur la rive la plus éloignée, et en
un autre instant, il s'était de nouveau relevé de toute sa hauteur, près de
le village de shepperton. immédiatement les six canons qui, à l'insu de
quiconque sur la rive droite s'était caché derrière les abords de cette
village, ont tiré simultanément. la soudaine quasi-commotion cérébrale, la dernière
proche du premier, mon cœur fit un bond. le monstre était déjà
soulevant le boîtier générant le rayon de chaleur lorsque le premier obus éclata six
mètres au-dessus du capot.","un instant après, il avait atteint la rive et, d’une enjambée, à demi
traversé le courant; les articulations de ses pieds d’avant se plièrent
en atteignant le bord opposé, mais presque aussitôt, à l’entrée du
village de shepperton, il reprit toute sa hauteur. immédiatement, les
six canons de la rive droite qui, ignorés de tous, avaient été
dissimulés à l’extrémité du village tirèrent à la fois. les détonations
si proches et soudaines, presque simultanées, me firent tressaillir. le
monstre élevait déjà l’étui générateur du rayon ardent, quand le premier
obus éclata à six mètres au-dessus de sa tête."
"i gave a cry of astonishment. i saw and thought nothing of the other
four martian monsters; my attention was riveted upon the nearer
incident. simultaneously two other shells burst in the air near the
body as the hood twisted round in time to receive, but not in time to
dodge, the fourth shell.","J'ai poussé un cri d'étonnement. Je n'ai rien vu et rien pensé des quatre autres monstres martiens.
quatre autres monstres martiens ; mon attention était rivée sur l'incident le plus proche.
simultanément deux autres obus éclataient en l'air près du corps.
le capuchon se retournait à temps pour recevoir le quatrième obus, mais pas à temps pour l'esquiver.
d'esquiver le quatrième obus.","j'ai poussé un cri d'étonnement. je n'ai rien vu et je n'ai rien pensé à l'autre
quatre monstres martiens ; mon attention était rivée sur le plus proche
incident. simultanément, deux autres obus éclatent en l'air à proximité du
corps alors que le capuchon se tournait à temps pour recevoir, mais pas à temps pour
esquiver, le quatrième obus.","je poussai un cri d’étonnement. je ne pensais plus aux quatre autres
monstres: mon attention était rivée sur cet incident si rapproché.
simultanément deux obus éclatèrent en l’air, mais près du corps du
marsien, au moment où la tête se tortillait juste à temps pour recevoir,
et trop tard pour esquiver, un quatrième obus. celui-ci éclata en plein
contre la tête du monstre."
"the shell burst clean in the face of the thing. the hood bulged,
flashed, was whirled off in a dozen tattered fragments of red flesh and
glittering metal.","l'obus a éclaté en plein dans le visage de la chose. le capot s'est gonflé,
s'envola en une douzaine de fragments de chair rouge et de métal scintillant.
de métal scintillant.","l'obus a éclaté à la face de la chose. le renflement du capot,
éclair, a été projeté en une douzaine de fragments de chair rouge en lambeaux et
métal scintillant.","l’espèce de capuchon de métal fut crevé,
éclata et alla tournoyer dans l’air en une douzaine de fragments de
métal brillant et de lambeaux de chair rougeâtre."
"hit! shouted i, with something between a scream and a cheer.","frappez ! criai-je, entre le cri et l'acclamation.",frapper! criai-je avec quelque chose entre un cri et une acclamation.,"touché! ce fut mon seul cri, quelque chose entre une acclamation et un
hurlement."
"i heard answering shouts from the people in the water about me. i could
have leaped out of the water with that momentary exultation.","J'ai entendu les cris de réponse des personnes qui se trouvaient dans l'eau autour de moi.
J'aurais pu sauter hors de l'eau avec cette exultation momentanée.","J'ai entendu les cris des gens dans l'eau à mon sujet. je pourrais
ont sauté hors de l'eau avec cette exultation momentanée.","j’entendis des cris répondant au mien, poussés par les gens qui étaient
dans l’eau autour de moi. je fus, dans cet instant de passagère
exultation, sur le point d’abandonner mon refuge."
"the decapitated colossus reeled like a drunken giant; but it did not
fall over. it recovered its balance by a miracle, and, no longer
heeding its steps and with the camera that fired the heat-ray now
rigidly upheld, it reeled swiftly upon shepperton. the living
intelligence, the martian within the hood, was slain and splashed to
the four winds of heaven, and the thing was now but a mere intricate
device of metal whirling to destruction. it drove along in a straight
line, incapable of guidance. it struck the tower of shepperton church,
smashing it down as the impact of a battering ram might have done,
swerved aside, blundered on and collapsed with tremendous force into
the river out of my sight.","le colosse décapité titubait comme un géant ivre, mais il ne tombait pas. il retrouvait miraculeusement l'équilibre et n'avait plus de raison d'être.
Il retrouva par miracle son équilibre et, ne faisant plus attention à ses pas, l'appareil
et, ne faisant plus attention à ses pas, l'appareil qui avait tiré le rayon de
de la chaleur, il roula rapidement sur Shepperton. l'intelligence vivante, le
l'intelligence vivante, le martien dans le capuchon, fut tué et éclaboussé aux quatre vents du ciel.
aux quatre vents du ciel, et la chose n'était plus qu'un simple dispositif
de métal tourbillonnant vers la destruction. il roulait en ligne droite, incapable de
ligne droite, incapable de se guider. il a frappé la tour de l'église de Shepperton,
l'écrasant comme l'aurait fait l'impact d'un bélier,
s'est écarté, a poursuivi sa route et s'est effondré avec une force énorme dans la rivière, hors de ma vue.
la rivière, hors de ma vue.","le colosse décapité chancela comme un géant ivre ; mais ce n'est pas le cas
tomber. il retrouva son équilibre par miracle, et, non plus
en tenant compte de ses pas et avec la caméra qui a tiré le rayon thermique maintenant
Maintenu rigidement, il chancela rapidement sur Shepperton. les vivants
l'intelligence, le martien sous le capot, a été tué et éclaboussé
les quatre vents du ciel, et la chose n'était plus qu'un simple problème complexe
dispositif de métal tourbillonnant vers la destruction. il a roulé en ligne droite
ligne, incapable de se guider. il a frappé la tour de l'église de Shepperton,
le briser comme aurait pu le faire l'impact d'un bélier,
a fait un écart, a fait une gaffe et s'est effondré avec une force énorme dans
la rivière hors de ma vue.","le colosse décapité chancela comme un géant ivre; mais il ne tomba pas.
par un véritable miracle, il recouvra son équilibre et sans plus prendre
garde où il allait, l’étui générateur du rayon ardent maintenu rigide en
l’air, il s’élança rapidement dans la direction de shepperton.
l’intelligence vivante, le marsien qui habitait la tête, avait été tué
et lancé aux quatre vents du ciel, et l’appareil n’était plus maintenant
qu’un simple assemblage de mécanismes compliqués tournoyant vers la
destruction. il s’avançait, suivant une ligne droite, incapable de se
guider. il heurta la tour de l’église de shepperton et la démolit, comme
le choc d’un bélier aurait pu le faire; il fut jeté de côté, trébucha et
s’écroula dans la rivière avec un fracas formidable."
