original english paragraphs,deepl paragraphs,google paragraphs,human-translated paragraphs
"The atmosphere of the earth, we now know, contains far more oxygen or far less argon (whichever way one likes to put it) than does Mars’. The invigorating influences of this excess of oxygen upon the Martians indisputably did much to counterbalance the increased weight of their bodies. And, in the second place, we all overlooked the fact that such mechanical intelligence as the Martian possessed was quite able to dispense with muscular exertion at a pinch.","Nous savons aujourd'hui que l'atmosphère terrestre contient beaucoup plus d'oxygène ou beaucoup moins d'argon (selon l'expression qui convient) que l'atmosphère martienne. L'influence vivifiante de cet excès d'oxygène sur les Martiens a incontestablement contribué à contrebalancer le poids accru de leurs corps. D'autre part, nous avons tous négligé le fait qu'une intelligence mécanique telle que celle des Martiens était tout à fait capable de se passer d'un effort musculaire à la rigueur.","L’atmosphère de la Terre, nous le savons maintenant, contient beaucoup plus d’oxygène ou beaucoup moins d’argon (quelle que soit la façon dont on aime l’exprimer) que celle de Mars. Les influences revigorantes de cet excès d’oxygène sur les Martiens ont incontestablement contribué à contrebalancer l’augmentation du poids de leur corps. Et, en deuxième lieu, nous avons tous négligé le fait que l'intelligence mécanique que possédait le Martien était tout à fait capable de se passer d'un effort musculaire à la rigueur.","L’atmosphère de la terre, nous le savons maintenant, contient beaucoup plus d’oxygène ou beaucoup moins d’argone peu importe la façon dont on l’explique que celle de Mars. L’influence fortifiante de l’oxygène sur les Marsiens fit indiscutablement beaucoup pour contrebalancer l’accroissement de poids de leur corps. En second lieu, nous ignorions tous ce fait que la puissance mécanique que possédaient les Marsiens était parfaitement capable, au besoin, de compenser la diminution d’activité musculaire."
"But I did not consider these points at the time, and so my reasoning was dead against the chances of the invaders. With wine and food, the confidence of my own table, and the necessity of reassuring my wife, I grew by insensible degrees courageous and secure.","Mais je n'avais pas envisagé ces points à l'époque, et mon raisonnement n'a donc rien donné face aux chances des envahisseurs. Avec le vin et la nourriture, la confiance de ma propre table et la nécessité de rassurer ma femme, je devins insensiblement plus courageux et plus sûr de moi.","Mais je n’ai pas pris en compte ces points à l’époque, et mon raisonnement était donc totalement contraire aux chances des envahisseurs. Avec le vin et la nourriture, la confiance de ma propre table et la nécessité de rassurer ma femme, je devins par degrés insensibles courageux et sûr de moi.","Mais je ne réfléchis pas à ces choses alors; aussi mon raisonnement concluait-il entièrement contre les chances des envahisseurs; le vin et la nourriture, la confiance de l’appétit satisfait et la nécessité de rassurer ma femme me rendirent, par degrés insensibles, mon courage et me firent croire à ma sécurité."
"They have done a foolish thing, said I, fingering my wineglass. They are dangerous because, no doubt, they are mad with terror. Perhaps they expected to find no living things—certainly no intelligent living things.","Ils ont fait une bêtise, dis-je en tripotant mon verre de vin. Ils sont dangereux parce que, sans doute, ils sont fous de terreur. Peut-être s'attendaient-ils à ne pas trouver d'êtres vivants - certainement pas d'êtres vivants intelligents.","Ils ont fait une bêtise, dis-je en touchant mon verre de vin. Ils sont dangereux parce que, sans doute, ils sont fous de terreur. Peut-être s’attendaient-ils à ne trouver aucun être vivant – et certainement aucun être vivant intelligent.","Ils ont fait là une chose stupide, assurai-je, le verre à la main. Ils sont dangereux, parce que sans aucun doute la peur les affole. Peut-être ne s’attendaient-ils pas à trouver des êtres vivants et certainement pas des êtres intelligents."
"A shell in the pit, said I, if the worst comes to the worst, will kill them all.","Un obus dans la fosse, dis-je, si le pire arrive, les tuera tous.","Un obus dans la fosse, dis-je, si le pire arrive, il les tuera tous.","Si les choses en viennent au pire, un obus dans le trou, et nous en serons débarrassés."
"The intense excitement of the events had no doubt left my perceptive powers in a state of erethism. I remember that dinner table with extraordinary vividness even now. My dear wife’s sweet anxious face peering at me from under the pink lamp shade, the white cloth with its silver and glass table furniture—for in those days even philosophical writers had many little luxuries—the crimson-purple wine in my glass, are photographically distinct. At the end of it I sat, tempering nuts with a cigarette, regretting Ogilvy’s rashness, and denouncing the short-sighted timidity of the Martians.","L'excitation intense des événements avait sans doute laissé mes capacités de perception dans un état d'éréthisme. Aujourd'hui encore, je me souviens de ce dîner avec une extraordinaire vivacité. Le doux visage anxieux de ma chère épouse qui me regardait sous l'abat-jour rose, la nappe blanche avec ses meubles de table en argent et en verre - à cette époque, même les écrivains philosophes avaient beaucoup de petits luxes - le vin cramoisi dans mon verre, sont photographiquement distincts. Au bout de ce verre, j'étais assis, tempérant les noix avec une cigarette, regrettant la témérité d'Ogilvy et dénonçant la timidité à courte vue des Martiens.","L'intense excitation des événements avait sans doute laissé mes facultés de perception dans un état d'éréthisme. Je me souviens encore aujourd’hui de cette table avec une extraordinaire vivacité. Le doux visage anxieux de ma chère épouse qui me regarde sous l'abat-jour rose, la nappe blanche avec ses meubles de table en argent et en verre - car à cette époque même les écrivains philosophiques avaient de nombreux petits luxes - le vin pourpre pourpre dans mon verre sont photographiquement visibles. distinct. À la fin, je me suis assis, tempérant les noix avec une cigarette, regrettant la témérité d’Ogilvy et dénonçant la timidité myope des Martiens.","L’intense surexcitation des événements avait sans aucun doute laissé mes facultés perceptives en état d’éréthisme. Maintenant encore, je me rappelle avec une extraordinaire vivacité ce dîner. La figure douce et anxieuse de ma femme tournée vers moi, sous l’abat-jour rose, la nappe blanche avec l’argenterie et la verrerie car, en ces jours-là, même les écrivains philosophiques se permettaient maints petits luxes le vin pourpre dans mon verre, tous ces détails sont photographiquement distincts. Au dessert, je m’attardai, combinant le goût des noix à une cigarette, regrettant l’imprudence d’Ogilvy et déplorant la peu clairvoyante pusillanimité des Marsiens."
"So some respectable dodo in the Mauritius might have lorded it in his nest, and discussed the arrival of that shipful of pitiless sailors in want of animal food. We will peck them to death tomorrow, my dear.","Ainsi, un respectable dodo de l'île Maurice aurait pu trôner dans son nid et discuter de l'arrivée de cette cargaison de marins impitoyables en manque de nourriture animale. Nous les picorerons à mort demain, ma chère.","Ainsi, quelque respectable dodo de l'Île Maurice aurait pu le régner dans son nid et discuter de l'arrivée de ce navire de marins impitoyables en manque de nourriture pour animaux. Nous les picorerons à mort demain, ma chère.","Ainsi quelque respectable dodo de l’île Maurice aurait pu, de son nid, envisager de cette façon les circonstances et, discutant l’arrivée d’un navire en quête de nourriture animale, aurait dit: Nous les mettrons à mort à coups de bec, demain, ma chère!"
"I did not know it, but that was the last civilised dinner I was to eat for very many strange and terrible days.","Je ne le savais pas, mais c'était le dernier dîner civilisé que je devais prendre avant de nombreux jours étranges et terribles.","Je ne le savais pas, mais ce fut le dernier dîner civilisé que je devais manger pendant de très nombreux jours étranges et terribles.","Sans le savoir, c’était le dernier dîner civilisé que je devais faire pendant d’étranges et terribles jours."
"The most extraordinary thing to my mind, of all the strange and wonderful things that happened upon that Friday, was the dovetailing of the commonplace habits of our social order with the first beginnings of the series of events that was to topple that social order headlong. If on Friday night you had taken a pair of compasses and drawn a circle with a radius of five miles round the Woking sand-pits, I doubt if you would have had one human being outside it, unless it were some relation of Stent or of the three or four cyclists or London people lying dead on the common, whose emotions or habits were at all affected by the new-comers. Many people had heard of the cylinder, of course, and talked about it in their leisure, but it certainly did not make the sensation that an ultimatum to Germany would have done.","La chose la plus extraordinaire à mes yeux, parmi toutes les choses étranges et merveilleuses qui se sont produites ce vendredi-là, a été la concordance entre les habitudes banales de notre ordre social et les premiers balbutiements de la série d'événements qui allaient faire basculer cet ordre social du jour au lendemain. Si, le vendredi soir, vous aviez pris une paire de compas et tracé un cercle d'un rayon de cinq miles autour des sablières de Woking, je doute qu'il y ait eu un seul être humain à l'extérieur de ce cercle, à moins qu'il ne s'agisse d'un parent de Stent ou des trois ou quatre cyclistes ou Londoniens étendus morts sur le terrain communal, dont les émotions ou les habitudes aient été affectées par les nouveaux arrivants. Beaucoup de gens avaient entendu parler du cylindre, bien sûr, et en parlaient pendant leurs loisirs, mais cela n'a certainement pas fait la même sensation qu'un ultimatum à l'Allemagne.","La chose la plus extraordinaire à mon avis, de toutes les choses étranges et merveilleuses qui se sont produites ce vendredi-là, a été la conjonction des habitudes banales de notre ordre social avec les premiers prémices de la série d’événements qui devaient bouleverser cet ordre social de plein fouet. Si vendredi soir vous aviez pris un compas et tracé un cercle d'un rayon de cinq milles autour des sablières de Woking, je doute que vous auriez eu un être humain à l'extérieur, à moins qu'il ne s'agisse d'un parent de Stent ou de les trois ou quatre cyclistes ou Londoniens gisant morts sur le terrain communal, dont les émotions ou les habitudes étaient affectées par les nouveaux arrivants. Bien sûr, beaucoup de gens avaient entendu parler du cylindre et en parlaient pendant leurs loisirs, mais cela ne produisait certainement pas la sensation qu'un ultimatum adressé à l'Allemagne aurait produit.","De toutes les choses surprenantes et merveilleuses qui arrivèrent ce vendredi-là, la plus étrange à mon esprit fut la combinaison des habitudes ordinaires et banales de notre ordre social avec les premiers débuts de la série d’événements qui devaient jeter à bas ce même ordre social. Si, le vendredi soir, prenant un compas, vous eussiez décrit un cercle d’un rayon de cinq milles autour des carrières de Woking, il est douteux que vous ayez pu trouver, en dehors de cet espace, un seul être humain à moins que ce ne fût quelque parent de Stent, ou des trois ou quatre cyclistes et des gens venus de Londres dont les cadavres étaient demeurés sur la lande qui eût été en rien affecté dans ses émotions et ses habitudes par les nouveaux venus. Beaucoup de gens, certes, avaient entendu parler du cylindre, en avaient même causé à leurs moments de loisir, mais cela n’avait certainement pas produit la sensation qu’aurait soulevée un ultimatum à l’Allemagne."
"In London that night poor Henderson’s telegram describing the gradual unscrewing of the shot was judged to be a canard, and his evening paper, after wiring for authentication from him and receiving no reply—the man was killed—decided not to print a special edition.","À Londres, cette nuit-là, le télégramme du pauvre Henderson décrivant le dévissage progressif du projectile est considéré comme un canular, et son journal du soir, après avoir câblé une authentification de sa part et n'avoir reçu aucune réponse - l'homme a été tué - décide de ne pas publier d'édition spéciale.","Cette nuit-là, à Londres, le télégramme du pauvre Henderson décrivant le dévissage progressif du coup de feu fut jugé comme un canard, et son journal du soir, après avoir télégraphié pour authentification de sa part et n'ayant reçu aucune réponse (l'homme fut tué), décida de ne pas imprimer d'édition spéciale.","A Londres, ce soir-là, le télégramme du malheureux Henderson, décrivant le dévissage graduel du projectile, fut reçu comme un canard et le journal du soir auquel il avait été adressé ayant, sans obtenir de réponse, télégraphié pour une confirmation de la nouvelle décida de ne pas lancer d’édition spéciale."
"Even within the five-mile circle the great majority of people were inert. I have already described the behaviour of the men and women to whom I spoke. All over the district people were dining and supping; working men were gardening after the labours of the day, children were being put to bed, young people were wandering through the lanes love-making, students sat over their books.","Même à l'intérieur du cercle des cinq miles, la grande majorité des gens étaient inertes. J'ai déjà décrit le comportement des hommes et des femmes à qui j'ai parlé. Dans tout le district, les gens dînaient et soupaient, les travailleurs jardinaient après les travaux de la journée, les enfants étaient mis au lit, les jeunes gens se promenaient dans les ruelles en faisant l'amour, les étudiants étaient assis sur leurs livres.","Même dans le cercle de huit kilomètres, la grande majorité des gens étaient inertes. J'ai déjà décrit le comportement des hommes et des femmes avec lesquels j'ai parlé. Dans tout le quartier, les gens dînaient et soupaient ; les ouvriers jardinaient après le travail de la journée, les enfants étaient couchés, les jeunes gens erraient dans les ruelles en faisant l'amour, les étudiants étaient assis devant leurs livres.","Même dans ce cercle fictif de cinq milles, la majorité des gens restaient indifférents. J’ai déjà décrit la conduite de ceux, hommes et femmes, auxquels je m’étais adressé. Dans tout le district, les gens dînaient et soupaient; les ouvriers jardinaient après les travaux du jour; on couchait les enfants; les jeunes gens erraient amoureusement par les chemins et les savants compulsaient leurs livres."
"Maybe there was a murmur in the village streets, a novel and dominant topic in the public-houses, and here and there a messenger, or even an eye-witness of the later occurrences, caused a whirl of excitement, a shouting, and a running to and fro; but for the most part the daily routine of working, eating, drinking, sleeping, went on as it had done for countless years—as though no planet Mars existed in the sky. Even at Woking station and Horsell and Chobham that was the case.","Peut-être y avait-il un murmure dans les rues du village, un sujet nouveau et dominant dans les maisons publiques, et ici et là un messager, ou même un témoin oculaire des derniers événements, provoquait un tourbillon d'excitation, un cri et une course à droite et à gauche ; mais pour l'essentiel, la routine quotidienne du travail, du manger, du boire, du dormir, continuait comme elle l'avait fait pendant d'innombrables années - comme si la planète Mars n'existait pas dans le ciel. Même à la gare de Woking, à Horsell et à Chobham, c'était le cas.","Peut-être y avait-il un murmure dans les rues du village, un sujet nouveau et dominant dans les débits de boissons, et çà et là un messager, ou même un témoin oculaire des événements ultérieurs, provoquait un tourbillon d'excitation, des cris et un bruit. courir d'avant en arrière; mais pour l’essentiel, la routine quotidienne consistant à travailler, manger, boire, dormir, se poursuivait comme elle l’avait fait depuis d’innombrables années – comme si aucune planète Mars n’existait dans le ciel. Même à la gare de Woking et à Horsell et Chobham, c'était le cas.","Peut-être y avait-il dans les rues du village un murmure inaccoutumé; un sujet de causerie nouveau et absorbant, dans les tavernes; ici et là un messager, ou même un témoin des derniers incidents, occasionnait quelque agitation, des cris et des allées et venues. Mais presque partout sans exception, la routine quotidienne: travailler, manger, boire et dormir, continuait ainsi que depuis d’innombrables années comme si nulle planète Mars n’eût existé dans les deux. Même à Woking, à Horsell et à Chobham, tel était le cas."
"In Woking junction, until a late hour, trains were stopping and going on, others were shunting on the sidings, passengers were alighting and waiting, and everything was proceeding in the most ordinary way. A boy from the town, trenching on Smith’s monopoly, was selling papers with the afternoon’s news. The ringing impact of trucks, the sharp whistle of the engines from the junction, mingled with their shouts of Men from Mars! Excited men came into the station about nine o’clock with incredible tidings, and caused no more disturbance than drunkards might have done. People rattling Londonwards peered into the darkness outside the carriage windows, and saw only a rare, flickering, vanishing spark dance up from the direction of Horsell, a red glow and a thin veil of smoke driving across the stars, and thought that nothing more serious than a heath fire was happening. It was only round the edge of the common that any disturbance was perceptible. There were half a dozen villas burning on the Woking border. There were lights in all the houses on the common side of the three villages, and the people there kept awake till dawn.","A Woking junction, jusqu'à une heure tardive, les trains s'arrêtaient et repartaient, d'autres manœuvraient sur les voies de garage, les passagers descendaient et attendaient, et tout se déroulait de la manière la plus ordinaire. Un garçon de la ville, profitant du monopole de Smith, vendait des journaux avec les nouvelles de l'après-midi. Le choc retentissant des camions, le sifflement aigu des moteurs de la jonction, se mêlaient aux cris de ""Men from Mars ! Des hommes excités sont entrés dans la gare vers neuf heures avec des nouvelles incroyables, et n'ont pas causé plus de perturbation que des ivrognes auraient pu le faire. Les gens qui se dirigeaient vers Londres regardaient dans l'obscurité à travers les fenêtres des wagons et ne voyaient qu'une étincelle rare, vacillante et disparaissant dans la direction de Horsell, une lueur rouge et un mince voile de fumée traversant les étoiles, et pensaient qu'il ne se passait rien de plus grave qu'un incendie de bruyère. Ce n'est qu'aux abords de la commune qu'une quelconque perturbation était perceptible. Une demi-douzaine de villas brûlaient à la frontière de Woking. Il y avait des lumières dans toutes les maisons du côté commun des trois villages, et les gens restèrent éveillés jusqu'à l'aube.","Au carrefour de Woking, jusqu'à une heure tardive, des trains s'arrêtaient et repartaient, d'autres faisaient des manœuvres sur les voies d'évitement, des passagers descendaient et attendaient, et tout se déroulait de la manière la plus ordinaire. Un garçon de la ville, attaquant le monopole de Smith, vendait des journaux avec les nouvelles de l’après-midi. Le tintement des camions, le sifflement aigu des moteurs du carrefour se mêlaient à leurs cris d'Hommes de Mars ! Des hommes excités arrivèrent à la gare vers neuf heures avec des nouvelles incroyables et ne provoquèrent pas plus de désordre que des ivrognes n'auraient pu le faire. Les gens qui se dirigeaient vers Londres scrutaient l'obscurité à l'extérieur des fenêtres du wagon et ne voyaient qu'une rare étincelle vacillante et disparue danser en direction de Horsell, une lueur rouge et un mince voile de fumée traversant les étoiles, et pensaient que rien de plus grave. qu'un incendie de bruyère se produisait. Ce n'était qu'aux abords de la commune qu'un trouble était perceptible. Il y avait une demi-douzaine de villas en feu à la frontière de Woking. Il y avait de la lumière dans toutes les maisons du côté commun des trois villages, et les gens restaient éveillés jusqu'à l'aube.","A la gare de Woking, jusqu’à une heure tardive, les trains s’arrêtaient et repartaient, d’autres se garaient sur les voies d’évitement, les voyageurs descendaient ou attendaient et toutes choses suivaient leur cours ordinaire. Un gamin de la ville, empiétant sur le monopole des bibliothèques de chemin de fer, vendait sur les quais des journaux renfermant les nouvelles de l’après-midi. Le vacarme des trucks, le sifflet aigu des locomotives, se mêlaient à ses cris de: “l’arrivée des habitants de Mars”. Des groupes agités envahirent la station vers neuf heures, racontant d’incroyables nouvelles et ne causèrent pas plus de trouble que des ivrognes n’auraient pu faire. Les gens en route vers Londres cherchaient, à travers les fenêtres des wagons, à apercevoir quelque chose dans les ténèbres du dehors et voyaient seulement de rares étincelles scintiller et s’élever en dansant dans la direction de Horsell, puis disparaître, une lueur rougeâtre et une mince traînée de fumée se promener contre l’écran du ciel, et ils en concluaient que rien n’arrivait de plus sérieux que quelque incendie dans les bruyères. Ce n’était que sur les confins de la lande qu’on pouvait voir réellement quelque désordre. Là, sur la lisière du côté de Woking, une douzaine de villas étaient en flammes. Des lumières restèrent allumées dans toutes les maisons des trois villages proches de la lande et les gens y veillèrent jusqu’à l’aurore."
"A curious crowd lingered restlessly, people coming and going but the crowd remaining, both on the Chobham and Horsell bridges. One or two adventurous souls, it was afterwards found, went into the darkness and crawled quite near the Martians; but they never returned, for now and again a light-ray, like the beam of a warship’s searchlight swept the common, and the Heat-Ray was ready to follow. Save for such, that big area of common was silent and desolate, and the charred bodies lay about on it all night under the stars, and all the next day. A noise of hammering from the pit was heard by many people.","Une foule curieuse s'attardait sans cesse, les gens allant et venant mais la foule restant, tant sur le pont de Chobham que sur celui de Horsell. On a découvert par la suite qu'un ou deux aventuriers s'étaient aventurés dans l'obscurité et avaient rampé tout près des Martiens, mais ils ne sont jamais revenus, car de temps en temps un rayon lumineux, comme le faisceau d'un projecteur de navire de guerre, balayait le terrain communal, et le rayon de chaleur était prêt à suivre. A part cela, cette grande étendue de terrain communal était silencieuse et désolée, et les corps carbonisés y restèrent toute la nuit sous les étoiles, et tout le jour suivant. Un bruit de marteau provenant de la fosse fut entendu par de nombreuses personnes.","Une foule curieuse s'attardait, agitée, les gens allaient et venaient mais la foule restait, tant sur les ponts Chobham que Horsell. On découvrit plus tard qu'une ou deux âmes aventureuses s'enfoncèrent dans l'obscurité et rampèrent tout près des Martiens ; mais ils ne revinrent jamais, car de temps en temps un rayon lumineux, semblable au faisceau d'un projecteur de navire de guerre, balayait la commune, et le rayon de chaleur était prêt à suivre. À part cela, cette grande zone commune était silencieuse et désolée, et les corps calcinés y restaient toute la nuit sous les étoiles, et toute la journée suivante. Un bruit de martèlement provenant de la fosse a été entendu par de nombreuses personnes.","Une foule curieuse s’attardait, incessamment renouvelée, à la fois sur le pont de Chobham et sur celui de Horsell. Une ou deux âmes aventureuses ainsi qu’on s’en aperçut après s’avancèrent à la faveur des ténèbres et se faufilèrent jusqu’auprès des Marsiens. Mais elles ne revinrent pas, car de temps en temps un rayon de lumière, semblable aux feux électriques d’un vaisseau de guerre, balayait la lande et le rayon brûlant le suivait immédiatement. A part cela, l’immense étendue demeura silencieuse et désolée, et les corps carbonisés y restèrent épars toute la nuit sous les étoiles et tout le jour suivant. Un bruit de métal qu’on martèle venait du cylindre et fut entendu par beaucoup de gens."
