original english paragraphs,deepl paragraphs,google paragraphs,human-translated paragraphs
"Death! I shouted. Death is coming! Death! and leaving him to digest that if he could, I hurried on after the artillery-man. At the corner I looked back. The soldier had left him, and he was still standing by his box, with the pots of orchids on the lid of it, and staring vaguely over the trees.","La mort ! ai-je crié. La mort arrive ! La mort ! et le laissant digérer cela s'il le pouvait, je me précipitai à la suite de l'artilleur. Au coin de la rue, je me retournai. Le soldat l'avait quitté, et il était toujours debout près de sa boîte, avec les pots d'orchidées sur le couvercle, et regardait vaguement par-dessus les arbres.","La mort! J'ai crié. La mort arrive ! La mort! et le laissant digérer cela, s'il le pouvait, je me précipitai après l'artilleur. Au coin, j'ai regardé en arrière. Le soldat l'avait quitté, et il était toujours debout près de sa caisse, avec les pots d'orchidées sur le couvercle, et regardant vaguement les arbres.","La Mort! criai-je. La Mort qui vient! La Mort! Le laissant digérer cela, s’il le pouvait, je m’élançai à la suite de l’artilleur. Au coin, je me retournai. Le caporal avait planté là le pauvre homme qui, debout auprès de sa malle, sur le couvercle de laquelle il avait posé ses pots, regardait d’un air hébété du côté des arbres."
"No one in Weybridge could tell us where the headquarters were established; the whole place was in such confusion as I had never seen in any town before. Carts, carriages everywhere, the most astonishing miscellany of conveyances and horseflesh. The respectable inhabitants of the place, men in golf and boating costumes, wives prettily dressed, were packing, river-side loafers energetically helping, children excited, and, for the most part, highly delighted at this astonishing variation of their Sunday experiences. In the midst of it all the worthy vicar was very pluckily holding an early celebration, and his bell was jangling out above the excitement.","Personne à Weybridge n'a pu nous dire où était établi le quartier général ; la confusion régnait partout, comme je n'en avais jamais vu dans aucune ville auparavant. Des charrettes, des voitures partout, le plus étonnant mélange de moyens de transport et de chevaux. Les habitants respectables de la ville, les hommes en costumes de golf et de bateau, les épouses joliment vêtues, faisaient leurs bagages, les flâneurs du bord de la rivière aidaient énergiquement, les enfants étaient excités et, pour la plupart, ravis de cette étonnante variation de leurs expériences dominicales. Au milieu de tout cela, le digne vicaire organisait avec beaucoup d'aplomb une célébration anticipée, et sa cloche tintait au-dessus de l'agitation.","Personne à Weybridge ne pouvait nous dire où était établi le quartier général ; tout l’endroit était dans une confusion telle que je n’en avais jamais vu dans aucune ville auparavant. Des charrettes, des voitures partout, le mélange le plus étonnant de moyens de transport et de viande de cheval. Les habitants respectables du lieu, hommes en costumes de golf et de canotage, épouses joliment habillées, faisaient leurs valises, les flâneurs au bord de la rivière aidant énergiquement, les enfants excités et, pour la plupart, très ravis de cette étonnante variation de leurs expériences dominicales. Au milieu de tout cela, le digne vicaire célébrait avec beaucoup de courage, et sa cloche tintait au-dessus de l'agitation.","Personne à Weybridge ne put nous dire où se trouvait le quartier général; je n’avais encore jamais vu de pareille confusion: des chariots, des voitures partout, formant le plus étonnant, mélange de moyens de transport et de chevaux. Les gens honorables de l’endroit, en costume de sports, leurs épouses élégamment mises, se hâtaient de faire leurs paquets, énergiquement aidés par tous les fainéants des environs, tandis que les enfants s’agitaient, absolument ravis, pour la plupart, de cette diversion inattendue à leurs ordinaires distractions dominicales. Au milieu de tout cela, le digne prêtre de la paroisse célébrait fort courageusement un service matinal et le vacarme de sa cloche s’efforçait de surmonter le tapage et le tumulte qui remplissaient le village."
"I and the artilleryman, seated on the step of the drinking fountain, made a very passable meal upon what we had brought with us. Patrols of soldiers—here no longer hussars, but grenadiers in white—were warning people to move now or to take refuge in their cellars as soon as the firing began. We saw as we crossed the railway bridge that a growing crowd of people had assembled in and about the railway station, and the swarming platform was piled with boxes and packages. The ordinary traffic had been stopped, I believe, in order to allow of the passage of troops and guns to Chertsey, and I have heard since that a savage struggle occurred for places in the special trains that were put on at a later hour.","Moi et l'artilleur, assis sur la marche de la fontaine, nous avons fait un repas très passable avec ce que nous avions apporté avec nous. Des patrouilles de soldats - ici ce ne sont plus des hussards, mais des grenadiers en blanc - avertissaient les gens de bouger maintenant ou de se réfugier dans leurs caves dès que la fusillade commencerait. En traversant le pont du chemin de fer, nous avons vu qu'une foule de plus en plus nombreuse s'était rassemblée dans et autour de la gare, et que le quai grouillant était encombré de boîtes et de paquets. Le trafic ordinaire avait été interrompu, je crois, pour permettre le passage des troupes et des canons vers Chertsey, et j'ai entendu dire depuis qu'une lutte sauvage avait eu lieu pour obtenir des places dans les trains spéciaux qui ont été mis en service à une heure plus tardive.","Moi et l'artilleur, assis sur la marche de la fontaine, nous fîmes un repas très passable avec ce que nous avions apporté avec nous. Des patrouilles de soldats — ici non plus des hussards, mais des grenadiers en blanc — avertissaient les gens de bouger maintenant ou de se réfugier dans leurs caves dès que les tirs commenceraient. En traversant le pont ferroviaire, nous avons constaté qu'une foule croissante de personnes s'était rassemblée dans et autour de la gare et que le quai grouillant était rempli de cartons et de colis. La circulation ordinaire avait été arrêtée, je crois, pour permettre le passage des troupes et des canons à Chertsey, et j'ai appris depuis qu'une lutte sauvage avait eu lieu pour les places dans les trains spéciaux qui partaient plus tard.","L’artilleur et moi, assis sur les marches de la fontaine, nous fîmes un repas suffisamment réconfortant avec les provisions que nous avions emportées dans nos poches. Des patrouilles de soldats, non plus de hussards ici, mais de grenadiers blancs, invitaient les gens à partir au plus vite ou à se réfugier dans leurs caves sitôt que la canonnade commencerait. En passant sur le pont du chemin de fer, nous vîmes qu’une foule, augmentant à chaque instant, s’était rassemblée dans la gare et les environs et que les quais fourmillants étaient encombrés de malles et de ballots innombrables. On avait, je crois, arrêté le mouvement des trains afin de procéder au transport des troupes et des canons, et j’ai su depuis qu’une lutte sauvage avait eu lieu quand il s’était agi de trouver place dans les trains spéciaux organisés plus tard."
"We remained at Weybridge until midday, and at that hour we found ourselves at the place near Shepperton Lock where the Wey and Thames join. Part of the time we spent helping two old women to pack a little cart. The Wey has a treble mouth, and at this point boats are to be hired, and there was a ferry across the river. On the Shepperton side was an inn with a lawn, and beyond that the tower of Shepperton Church—it has been replaced by a spire—rose above the trees.","Nous sommes restés à Weybridge jusqu'à midi, et à cette heure-là, nous nous sommes retrouvés près de l'écluse de Shepperton, là où la Wey et la Tamise se rejoignent. Nous avons passé une partie de notre temps à aider deux vieilles femmes à charger une petite charrette. La Wey a une triple embouchure, et à cet endroit on peut louer des bateaux, et il y avait un bac pour traverser la rivière. Du côté de Shepperton, il y avait une auberge avec une pelouse, et au-delà, la tour de l'église de Shepperton - qui a été remplacée par une flèche - s'élevait au-dessus des arbres.","Nous restâmes à Weybridge jusqu'à midi, et à cette heure nous nous trouvâmes à l'endroit près de l'écluse de Shepperton, là où se rejoignent la Wey et la Tamise. Nous avons passé une partie de notre temps à aider deux vieilles femmes à préparer une petite charrette. Le Wey a une embouchure triple, et à ce stade, des bateaux doivent être loués, et il y avait un ferry pour traverser la rivière. Du côté de Shepperton se trouvait une auberge avec une pelouse, et au-delà la tour de l'église de Shepperton - elle a été remplacée par une flèche - s'élevait au-dessus des arbres.","Nous restâmes à Weybridge jusqu’à midi, et à cette heure nous nous trouvâmes à l’endroit où, près de l’écluse de Shepperton, la Wey se jette dans la Tamise. Nous employâmes une partie de notre temps en aidant deux vieilles femmes à charger une petite voiture. La Wey a trois bras à son embouchure: il y a là un grand nombre-de loueurs de bateaux et de plus un bac qui traverse la rivière. Du côté de Shepperton se trouvait une auberge avec, sur le devant, une pelouse; et, au delà, la tour de l’église on l’a depuis remplacée par un clocher s’élevait par-dessus les arbres."
"Here we found an excited and noisy crowd of fugitives. As yet the flight had not grown to a panic, but there were already far more people than all the boats going to and fro could enable to cross. People came panting along under heavy burdens; one husband and wife were even carrying a small outhouse door between them, with some of their household goods piled thereon. One man told us he meant to try to get away from Shepperton station.","C'est là que nous avons trouvé une foule excitée et bruyante de fugitifs. La fuite n'avait pas encore dégénéré en panique, mais il y avait déjà beaucoup plus de monde que les bateaux qui allaient et venaient ne pouvaient permettre de traverser. Les gens avançaient en haletant sous de lourds fardeaux ; un mari et sa femme portaient même entre eux une petite porte de toilettes extérieures, sur laquelle ils avaient empilé une partie de leur mobilier. Un homme nous a dit qu'il avait l'intention d'essayer de quitter la gare de Shepperton.","Ici, nous avons trouvé une foule agitée et bruyante de fugitifs. La fuite n'avait pas encore tourné à la panique, mais il y avait déjà beaucoup plus de monde que tous les bateaux qui allaient et venaient ne pouvaient en permettre de traverser. Les gens arrivaient haletants sous de lourds fardeaux ; un mari et une femme portaient même entre eux une petite porte de dépendance, sur laquelle étaient entassés certains de leurs objets ménagers. Un homme nous a dit qu'il avait l'intention d'essayer de s'éloigner de la gare de Shepperton.","Là se pressait, surexcitée et tumultueuse, une foule de fugitifs. Jusqu’ici ce n’était pas encore devenu une panique, mais il y avait déjà beaucoup plus de monde que les bateaux ne parviendraient à en traverser. Des gens arrivaient chancelant sous de lourds fardeaux. Deux personnes même, le mari et la femme, s’avançaient avec une petite porte de cabane sur laquelle ils avaient entassé tout ce qu’ils avaient pu trouver d’objets domestiques. Un homme nous confia qu’il allait essayer de se sauver en prenant le train à la station de Shepperton."
"There was a lot of shouting, and one man was even jesting. The idea people seemed to have here was that the Martians were simply formidable human beings, who might attack and sack the town, to be certainly destroyed in the end. Every now and then people would glance nervously across the Wey, at the meadows towards Chertsey, but everything over there was still.","Il y avait beaucoup de cris, et un homme plaisantait même. L'idée que les gens semblaient avoir ici était que les Martiens n'étaient que de redoutables êtres humains, qui pourraient attaquer et mettre la ville à sac, pour être certainement détruits à la fin. De temps en temps, les gens jetaient un coup d'œil nerveux de l'autre côté de la Wey, vers les prairies en direction de Chertsey, mais tout était immobile là-bas.","Il y avait beaucoup de cris et un homme plaisantait même. L'idée que les gens semblaient avoir ici était que les Martiens étaient simplement des êtres humains redoutables, capables d'attaquer et de saccager la ville, pour être finalement détruits. De temps en temps, les gens regardaient nerveusement de l'autre côté de la Wey, vers les prairies en direction de Chertsey, mais là-bas, tout était immobile.","On n’entendait partout que des cris et quelques farceurs même plaisantaient. L’idée que semblaient avoir les habitants de l’endroit, c’était que les Marsiens ne pouvaient être que de formidables êtres humains qui attaqueraient et saccageraient le bourg, pour être immanquablement détruits à la fin. De temps à autre, des gens regardaient avec une certaine impatience par delà la Wey, vers les prairies de Chertsey, mais tout, de ce côté, était tranquille."
"Across the Thames, except just where the boats landed, everything was quiet, in vivid contrast with the Surrey side. The people who landed there from the boats went tramping off down the lane. The big ferryboat had just made a journey. Three or four soldiers stood on the lawn of the inn, staring and jesting at the fugitives, without offering to help. The inn was closed, as it was now within prohibited hours.","De l'autre côté de la Tamise, à l'exception de l'endroit où les bateaux accostent, tout est calme, ce qui contraste fortement avec la rive du Surrey. Les personnes qui débarquaient des bateaux s'en allaient en trottinant dans la ruelle. Le grand ferry-boat vient d'effectuer un voyage. Trois ou quatre soldats se tenaient sur la pelouse de l'auberge, regardant et plaisantant les fugitifs, sans offrir leur aide. L'auberge était fermée, car elle se trouvait maintenant à l'intérieur des heures interdites.","De l’autre côté de la Tamise, sauf là où les bateaux débarquaient, tout était calme, contrastant fortement avec le côté du Surrey. Les gens qui débarquaient là depuis les bateaux s'en allaient d'un pas lourd dans la ruelle. Le grand ferry venait de faire un voyage. Trois ou quatre soldats se tenaient sur la pelouse de l'auberge, regardant et plaisantant les fugitifs, sans proposer leur aide. L'auberge était fermée, car elle se situait désormais aux heures interdites.","Sur l’autre rive de la Tamise, excepté à l’endroit où les bateaux abordaient, il n’y avait de même aucun trouble, ce qui faisait un contraste violent avec la rive du Surrey. En débarquant, les gens partaient immédiatement par le petit chemin. L’énorme bac n’avait encore fait qu’un seul voyage. Trois ou quatre soldats, de la pelouse de l’auberge, regardaient ces fugitifs et les raillaient, sans songer à offrir leur aide. L’auberge était close, car on était maintenant aux heures prohibées."
"What’s that? cried a boatman, and Shut up, you fool! said a man near me to a yelping dog. Then the sound came again, this time from the direction of Chertsey, a muffled thud—the sound of a gun.","Qu'est-ce que c'est ? s'écria un batelier, et Tais-toi, imbécile ! dit un homme près de moi à un chien qui jappait. Puis le bruit est revenu, cette fois de la direction de Chertsey, un bruit sourd - le bruit d'un fusil.","Qu'est ce que c'est? s'écria un batelier, et Tais-toi, imbécile ! dit un homme près de moi à un chien qui jappait. Puis le bruit revint, cette fois en provenance de Chertsey, un bruit sourd – le bruit d’une arme à feu.","Qu’est-ce que c’est que tout cela? s’exclamait un batelier. Puis, plus près de moi: Tais-toi donc, sale bête! criait un homme à un chien qui hurlait. A ce moment, on entendit de nouveau, mais cette fois dans la direction de Chertsey, un son assourdi la détonation d’un canon."
"The fighting was beginning. Almost immediately unseen batteries across the river to our right, unseen because of the trees, took up the chorus, firing heavily one after the other. A woman screamed. Everyone stood arrested by the sudden stir of battle, near us and yet invisible to us. Nothing was to be seen save flat meadows, cows feeding unconcernedly for the most part, and silvery pollard willows motionless in the warm sunlight.","Les combats commençaient. Presque immédiatement, des batteries invisibles de l'autre côté de la rivière, à notre droite, invisibles à cause des arbres, reprennent le refrain, tirant lourdement l'une après l'autre. Une femme a crié. Tout le monde s'arrêta dans l'agitation soudaine de la bataille, proche de nous et pourtant invisible pour nous. On ne voyait rien d'autre que des prairies plates, des vaches qui paissaient sans souci pour la plupart, et des saules têtards argentés immobiles dans la chaude lumière du soleil.","Les combats commençaient. Presque immédiatement, des batteries invisibles de l'autre côté de la rivière, à notre droite, invisibles à cause des arbres, reprirent le chœur, tirant lourdement les unes après les autres. Une femme a crié. Tout le monde était arrêté par le bruit soudain de la bataille, près de nous et pourtant invisible pour nous. On ne voyait rien d'autre que des prairies plates, des vaches se nourrissant pour la plupart insouciantes et des saules têtards argentés immobiles dans la chaleur du soleil.","La lutte commençait. Presque immédiatement, d’invisibles batteries, cachées par des bouquets d’arbres sur l’autre rive du fleuve, à notre droite, firent chorus, crachant leurs obus régulièrement l’une après l’autre. Une femme s’évanouit. Tout le monde sursauta, avec, en suspens, le soudain émoi de la bataille si proche et que nous ne pouvions voir encore. Le regard ne parcourait que des prairies unies, où des bœufs paissaient avec indifférence entre des saules argentés au feuillage immobile sous le chaud soleil."
"The sojers’ll stop ’em, said a woman beside me, doubtfully. A haziness rose over the treetops.","Les sojers les arrêteront, dit une femme à côté de moi, dubitative. Une brume s'élève au-dessus de la cime des arbres.","Les sojers vont les arrêter, dit une femme à côté de moi, dubitative. Une brume s’élevait au-dessus de la cime des arbres.","Les soldats les arrêteront bien, dit une femme, d’un ton peu rassuré. Une brume monta au-dessus des arbres."
"Then suddenly we saw a rush of smoke far away up the river, a puff of smoke that jerked up into the air and hung; and forthwith the ground heaved under foot and a heavy explosion shook the air, smashing two or three windows in the houses near, and leaving us astonished.","Soudain, nous avons vu une bouffée de fumée au loin, en amont de la rivière, une bouffée de fumée qui s'est élevée dans les airs et qui est restée suspendue ; aussitôt, le sol s'est soulevé sous les pieds et une forte explosion a secoué l'air, brisant deux ou trois fenêtres des maisons voisines, ce qui nous a laissés stupéfaits.","Puis, tout à coup, nous avons aperçu un nuage de fumée au loin en amont de la rivière, une bouffée de fumée qui s'est élevée dans l'air et s'est suspendue ; et aussitôt le sol se souleva sous les pieds et une forte explosion secoua l'air, brisant deux ou trois fenêtres des maisons voisines, et nous laissant étonnés.","Puis soudain nous vîmes un énorme flot de fumée qui envahit rapidement le ciel; au même moment, le sol trembla sous nos pieds et une explosion immense secoua l’atmosphère, brisant les vitres des maisons proches et nous plongeant dans la stupéfaction."
Here they are! shouted a man in a blue jersey. Yonder! D’yer see them? Yonder!,Les voilà ! crie un homme en maillot bleu. Là-bas ! Vous les voyez ? Là-bas !,Les voilà ! » a crié un homme en maillot bleu. Là-bas ! Vous les voyez ? Là-bas !,Les voilà! cria un homme vêtu d’un jersey bleu. Là-bas! Les voyez-vous? Là-bas!
"Quickly, one after the other, one, two, three, four of the armoured Martians appeared, far away over the little trees, across the flat meadows that stretched towards Chertsey, and striding hurriedly towards the river. Little cowled figures they seemed at first, going with a rolling motion and as fast as flying birds.","Rapidement, l'un après l'autre, un, deux, trois, quatre Martiens en armure apparurent, loin au-dessus des petits arbres, à travers les prairies plates qui s'étendaient vers Chertsey, et se dirigeant à grandes enjambées vers la rivière. Ils semblaient d'abord de petites silhouettes encapuchonnées, allant avec un mouvement de roulis et aussi vite que des oiseaux volants.","Rapidement, l'un après l'autre, un, deux, trois, quatre des Martiens en armure apparurent, au loin, au-dessus des petits arbres, à travers les prairies plates qui s'étendaient vers Chertsey, et s'avançant à grands pas vers la rivière. Au début, ils ressemblaient à de petites figures encapuchonnées, se déplaçant avec un mouvement de roulement et aussi vite que des oiseaux en vol.","Rapidement, l’un après l’autre, parurent deux, trois, puis quatre Marsiens, bien loin par delà les arbres bas, à travers les prés s’étendant jusqu’à Chertsey et ils se dirigeaient avec d’énormes enjambées vers la rivière. Ils parurent être, d’abord, de petites formes encapuchonnées, s’avançant à une allure aussi rapide que le vol des oiseaux."
"Then, advancing obliquely towards us, came a fifth. Their armoured bodies glittered in the sun as they swept swiftly forward upon the guns, growing rapidly larger as they drew nearer. One on the extreme left, the remotest that is, flourished a huge case high in the air, and the ghostly, terrible Heat-Ray I had already seen on Friday night smote towards Chertsey, and struck the town.","Puis, s'avançant obliquement vers nous, un cinquième. Leurs corps blindés scintillaient au soleil tandis qu'ils s'avançaient rapidement sur les canons, grossissant rapidement à mesure qu'ils se rapprochaient. L'un d'eux, à l'extrême gauche, c'est-à-dire le plus éloigné, brandit une énorme caisse en l'air, et le terrible rayon de chaleur fantomatique que j'avais déjà vu le vendredi soir se dirigea vers Chertsey et frappa la ville.","Puis, s'avançant obliquement vers nous, arriva un cinquième. Leurs corps blindés brillaient au soleil alors qu’ils avançaient rapidement sur les canons, grandissant rapidement à mesure qu’ils se rapprochaient. L'un à l'extrême gauche, c'est-à-dire le plus éloigné, s'est élevé dans les airs, et le terrible et fantomatique Heat-Ray que j'avais déjà vu vendredi soir a frappé Chertsey et a frappé la ville.","Puis, arrivant obliquement dans notre direction, un cinquième monstre parut. Leur masse cuirassée scintillait au soleil, tandis qu’ils accouraient vers les pièces d’artillerie et ils paraissaient de plus en plus grands à mesure qu’ils approchaient. L’un d’eux, le plus éloigné vers la gauche, brandissait aussi haut qu’il pouvait une sorte d’immense étui, et ce terrible et sinistre Rayon Ardent, que j’avais vu à l’œuvre le vendredi soir, jaillit soudain dans la direction de Chertsey et attaqua la ville."
